PMID,Title,Authors,Journal,Abstract,Publication Date,Volume,Issue,Pages,DOI
,The impact of mental health disorders and job demands on the individual job        performance of construction workers. LID - 10.1093/joccuh/uiae060 [doi] LID - uiae060,"['Kazar G', 'Rahmanzadeh P']",J Occup Health,"OBJECTIVES: Understanding the impact of job demands and mental health disorders        on individual job performance is crucial to achieving a more productive workforce        and should be empirically investigated. Therefore, the main purpose of this study        was to assess the impact of job demands and mental health disorders on individual        job performance among construction workers. In addition, we examined the        interaction effect between job demands and some demographic characteristics        (income, marital status, experience, and area of residence) on the job        performance of construction workers in 2 dimensions. METHODS: For this purpose, a        new conceptual model and 3 different hypotheses were introduced. A survey was        designed and administered to 513 construction workers. Whereas the measurement        items regarding demographic characteristics, job demands, and mental health        disorders were addressed to construction workers, the last part related to job        performance of construction workers was conducted with site managers of the        workers to obtain more objective results. A structural equation modeling approach        was adopted to assess the validity of the model and to test the hypotheses.        RESULTS: The results of this study show that whereas job demands have a        significant and high impact on individual job performance, the effect of mental        health disorders on job performance is significant at a moderate level. In        addition, the demographic characteristics of marital status and area of residence        have a significant interaction effect on job performance when combined with job        demands. CONCLUSION: Providing individualized support systems, resources, and        opportunities for construction workers can help mitigate the negative effects of        excessive demands and mental disorders on labor productivity.",2024 Jan 4,66,1,,10.1093/joccuh/uiae060
,Predictors of Attitudes Toward Non-Technical Skills in Farming.,"['Irwin A', 'Poots J']",J Agromedicine,"OBJECTIVES: Farming is a high-risk sector with up to 170,000 worldwide fatalities        reported per year; it is therefore vital to identify methods of mitigating the        dangers of this industry. Research within high-risk industries, such as aviation,        shipping, and agriculture, has identified the importance of non-technical skills        (NTS) in maintaining effective, safe performance and reducing error and injury.        However, there is a lack of research evaluating factors that may contribute to        NTS attitudes and behaviors. As a first step to address this literature gap, the        current study evaluated a range of individual and environmental factors as        potential predictors of attitudes toward NTS in agriculture. METHOD: A sample of        170 farmers from within the United Kingdom and Ireland were surveyed using an        online questionnaire. The questionnaire included measures of personality, stress,        attitudes toward safety (safety climate, motivation, and risk), environmental        stressors (workload, work-life imbalance), and non-technical skills (team and        lone worker). RESULTS: Attitudes toward safety climate, compliance, and        motivation showed a significant association with both team-based and lone worker        NTS. Conscientiousness correlated positively with the majority of the NTS        elements. Multiple regression analysis indicated neuroticism and        conscientiousness demonstrated capacity to predict NTS attitudes. Concerns about        costs and equipment, attitudes toward safety climate, and safety motivation were        also found to be significant predictors of NTS attitudes. CONCLUSION: The results        indicate the utility of individual characteristics and environmental factors when        predicting farming NTS attitudes. As a result, these elements could be important        when evaluating engagement with NTS and developing NTS training initiatives in        agriculture. FAU - Irwin, Amy",2018,23,1,60-69,10.1080/1059924X.2017.1384775
,"Associations between worker characteristics, workplace factors, and work-related        musculoskeletal disorders: a cross-sectional study of male construction workers        in Nigeria.","['Ekpenyong CE', 'Inyang UC']",Int J Occup Saf Ergon,"OBJECTIVE: This study assessed the association between worker characteristics,        workplace factors, and work-related musculoskeletal disorders (WMSDs) in        Nigeria's construction industry. METHODS: A cross-sectional site-by-site survey        was conducted in 5 existing construction companies in Uyo, Nigeria. The subjects        (n = 1200 males), aged 18-55 years, filled in the semistructured Nordic        musculoskeletal questionnaire and the job content questionnaire on demographics,        work and lifestyle characteristics, and workplace risk factors for WMSDs.        RESULTS: The overall prevalence of WMSDs was 39.25%. Differences in age, race,        weight, body mass index (BMI), education status, and employment status were        significantly associated with the prevalence of WMSDs. Prevalence according to        trade was as follows: ironworkers highest at 49% and administrative staff lowest        at 31%. Ironworkers (55.7%), administrative staff (53.3%), and security staff        (38.7%) scored higher on physical, psychosocial, and individual risk factors,        respectively. Workplace factors with increased odds for WMSDs were psychological        demands and mental workload, age, BMI, low work experience, low education status,        awkward movement of head and arms, working against force or vibration, fast work        pace, and race. CONCLUSION: The recorded high prevalence was multifactorial in        etiology; hence, multi-intervention strategies are required. FAU - Ekpenyong, Christopher Edet",2014,20,3,447-62,10.1080/10803548.2014.11077057
,Development of the Fatigue Risk Assessment and Management in High-Risk        Environments (FRAME) Survey: A Participatory Approach. LID - 10.3390/ijerph16040522 [doi] LID - 522,"['Shortz AE', 'Mehta RK', 'Peres SC', 'Benden ME', 'Zheng Q']",Int J Environ Res Public Health,"Existing risk assessment tools are not effective or sustainable in identifying        Oil and Gas Extraction (OGE) workers at high risk of fatigue-related injuries or        incidents. We developed a comprehensive Fatigue Risk Assessment and Management in        high-risk Environments (FRAME) survey through an industry-academic participatory        approach. The FRAME survey was developed through: (1) systematic gathering of        existing fatigue scales; (2) refining the inventory using the Delphi Consensus        technique; and (3) further refinement through employee/worker focus groups. The        participatory approach resulted in a final FRAME survey across four fatigue        dimensions-sleep, shiftwork, physical, and mental fatigue, and was composed of 26        items. The FRAME survey was founded on occupational fatigue science and refined        and tailored to the OGE industry, through rigorous industry stakeholder input,        for safer, effective, practical, and sustainable fatigue assessment and        management efforts. FAU - Shortz, Ashley E",2019 Feb 13,16,4,,10.3390/ijerph16040522
,"Job demands, job resources, and job performance in japanese workers: a        cross-sectional study.","['Nakagawa Y', 'Inoue A', 'Kawakami N', 'Tsuno K', 'Tomioka K', 'Nakanishi M', 'Mafune K', 'Hiro H']",Ind Health,"This study investigated the cross-sectional association of job demands (i.e.,        psychological demands) and job resources (i.e., decision latitude, supervisor        support, co-worker support, and extrinsic reward) with job performance. A total        of 1,198 workers (458 males and 740 females) from a manufacturing company in        Japan completed a self-administered questionnaire that included the Job Content        Questionnaire, Effort-Reward Imbalance Questionnaire, World Health Organization        Health and Work Performance Questionnaire, and demographic survey. Hierarchical        multiple regression analyses were conducted. After adjusting for demographic        characteristics, decision latitude (β=0.107, p=0.001) and extrinsic reward        (β=0.158, p<0.001) were positively and significantly associated with job        performance while supervisor support (β=-0.102, p=0.002) was negatively and        significantly associated with job performance. On the other hand, psychological        demands or co-worker support was not significantly associated with job        performance. These findings suggest that higher decision latitude and extrinsic        reward enhance job performance among Japanese employees. FAU - Nakagawa, Yuko",2014,52,6,471-9,10.2486/indhealth.2014-0036
,Profiling the U.S. Sick Leave Landscape: Presenteeism among Females.,"['Susser P', 'Ziebarth NR']",Health Serv Res,"OBJECTIVE: To profile the sick leave landscape in the United States. DATA        SOURCES: The 2011 Leave Supplement of the American Time Use Survey. STUDY DESIGN:        Bivariate and multivariate analyses to identify (i) employees without sick pay        coverage and (ii) employees who attend work sick. PRINCIPAL FINDINGS: Sixty-five        percent of full-time employees have sick pay coverage. Coverage rates are below        20 percent for employees with hourly wages below $10, part-time employees, and        employees in the hospitality and leisure industry. CONCLUSION: Each week, up to 3        million U.S. employees go to work sick. Females, low-income earners, and those        aged 25 to 34 years have a significantly elevated risk of presenteeism behavior.",2016 Dec,51,6,2305-2317,10.1111/1475-6773.12471
,Work-break schedules for preventing musculoskeletal symptoms and disorders in        healthy workers.,"['Luger T', 'Maher CG', 'Rieger MA', 'Steinhilber B']",Cochrane Database Syst Rev,"BACKGROUND: Work-related musculoskeletal disorders are a group of musculoskeletal        disorders that comprise one of the most common disorders related to occupational        sick leave worldwide. Musculoskeletal disorders accounted for 21% to 28% of work        absenteeism days in 2017/2018 in the Netherlands, Germany and the UK. There are        several interventions that may be effective in tackling the high prevalence of        work-related musculoskeletal disorders among workers, such as physical, cognitive        and organisational interventions. In this review, we will focus on work breaks as        a measure of primary prevention, which are a type of organisational intervention.        OBJECTIVES: To compare the effectiveness of different work-break schedules for        preventing work-related musculoskeletal symptoms and disorders in healthy        workers, when compared to conventional or alternate work-break schedules. SEARCH        METHODS: We searched the Cochrane Central Register of Controlled Trials        (CENTRAL), MEDLINE, Embase, CINAHL, PsycINFO, SCOPUS, Web of Science,        ClinicalTrials.gov and the World Health Organization International Clinical        Trials Registry Platform, to April/May 2019. In addition, we searched references        of the included studies and of relevant literature reviews. SELECTION CRITERIA:        We included randomised controlled trials (RCTs) of work-break interventions for        preventing work-related musculoskeletal symptoms and disorders among workers. The        studies were eligible for inclusion when intervening on work-break frequency,        duration and/or type, compared to conventional or an alternate work-break        intervention. We included only those studies in which the investigated population        included healthy, adult workers, who were free of musculoskeletal complaints        during study enrolment, without restrictions to sex or occupation. The primary        outcomes were newly diagnosed musculoskeletal disorders, self-reported        musculoskeletal pain, discomfort or fatigue, and productivity or work        performance. We considered workload changes as secondary outcomes. DATA        COLLECTION AND ANALYSIS: Two review authors independently screened titles,        abstracts and full texts for study eligibility, extracted data and assessed risk        of bias. We contacted authors for additional study data where required. We        performed meta-analyses, where possible, and we assessed the overall quality of        the evidence for each outcome of each comparison using the five GRADE        considerations. MAIN RESULTS: We included six studies (373 workers), four        parallel RCTs, one cross-over RCT, and one combined parallel plus cross-over RCT.        At least 295 of the employees were female and at least 39 male; for the remaining        39 employees, the sex was not specified in the study trial. The studies        investigated different work-break frequencies (five studies) and different        work-break types (two studies). None of the studies investigated different        work-break durations. We judged all studies to have a high risk of bias. The        quality of the evidence for the primary outcomes of self-reported musculoskeletal        pain, discomfort and fatigue was low; the quality of the evidence for the primary        outcomes of productivity and work performance was very low. The studies were        executed in Europe or Northern America, with none from low- to middle-income        countries. One study could not be included in the data analyses, because no        detailed results have been reported.Changes in the frequency of work breaksThere        is low-quality evidence that additional work breaks may not have a considerable        effect on musculoskeletal pain, discomfort or fatigue, when compared with no        additional work breaks (standardised mean difference (SMD) -0.08; 95% CI -0.35 to        0.18; three studies; 225 participants). Additional breaks may not have a positive        effect on productivity or work performance, when compared with no additional work        breaks (SMD -0.07; 95% CI -0.33 to 0.19; three studies; 225 participants; very        low-quality evidence).We found low-quality evidence that additional work breaks        may not have a considerable effect on participant-reported musculoskeletal pain,        discomfort or fatigue (MD 1.80 on a 100-mm VAS scale; 95% CI -41.07 to 64.37; one        study; 15 participants), when compared to work breaks as needed (i.e. microbreaks        taken at own discretion). There is very low-quality evidence that additional work        breaks may have a positive effect on productivity or work performance, when        compared to work breaks as needed (MD 542.5 number of words typed per 3-hour        recording session; 95% CI 177.22 to 907.78; one study; 15        participants).Additional higher frequency work breaks may not have a considerable        effect on participant-reported musculoskeletal pain, discomfort or fatigue (MD        11.65 on a 100-mm VAS scale; 95% CI -41.07 to 64.37; one study; 10 participants;        low-quality evidence), when compared to additional lower frequency work breaks.        We found very low-quality evidence that additional higher frequency work breaks        may not have a considerable effect on productivity or work performance (MD -83.00        number of words typed per 3-hour recording session; 95% CI -305.27 to 139.27; one        study; 10 participants), when compared to additional lower frequency work        breaks.Changes in the duration of work breaksNo trials were identified that        assessed the effect of different durations of work breaks.Changes in the type of        work breakWe found low-quality evidence that active breaks may not have a        considerable positive effect on participant-reported musculoskeletal pain,        discomfort and fatigue (MD -0.17 on a 1-7 NRS scale; 95% CI -0.71 to 0.37; one        study; 153 participants), when compared to passive work breaks.Relaxation work        breaks may not have a considerable effect on participant-reported musculoskeletal        pain, discomfort or fatigue, when compared to physical work breaks (MD 0.20 on a        1-7 NRS scale; 95% CI -0.43 to 0.82; one study; 97 participants; low-quality        evidence). AUTHORS' CONCLUSIONS: We found low-quality evidence that different        work-break frequencies may have no effect on participant-reported musculoskeletal        pain, discomfort and fatigue. For productivity and work performance, evidence was        of very low-quality that different work-break frequencies may have a positive        effect. For different types of break, there may be no effect on        participant-reported musculoskeletal pain, discomfort and fatigue according to        low-quality evidence. Further high-quality studies are needed to determine the        effectiveness of frequency, duration and type of work-break interventions among        workers, if possible, with much higher sample sizes than the studies included in        the current review. Furthermore, work-break interventions should be reconsidered,        taking into account worker populations other than office workers, and taking into        account the possibility of combining work-break intervention with other        interventions such as ergonomic training or counselling, which may may possibly        have an effect on musculoskeletal outcomes and work performance. FAU - Luger, Tessy",2019 Jul 23,7,7,CD012886,10.1002/14651858.CD012886.pub2
,Associations between occupational relative aerobic workload and resting blood        pressure among different age groups: a cross-sectional analysis in the DPhacto        study.,"['Korshøj M', 'Clays E', 'Krause N', 'Gupta N', 'Jørgensen MB', 'Holtermann A']",BMJ Open,"OBJECTIVE: High levels of occupational physical activity (OPA) increase heart        rate, blood pressure (BP) and the risk of hypertension. Older workers may be more        vulnerable to high levels of OPA due to age-related degeneration of the        cardiovascular system and cardiorespiratory fitness. This study investigates the        association of relative aerobic workload (RAW) with resting BP and examines if        this relation is moderated by age. DESIGN: Cross-sectional epidemiological study.        SETTING: Data were collected among employees of 15 Danish companies in the        cleaning, manufacturing and transport sectors. PARTICIPANTS: 2107 employees were        invited for participation, of these 1087 accepted and 562 (42% female and 4%        non-Westerns) were included in the analysis based on the criteria of being        non-pregnant, no allergy to bandages, sufficient amount of heart rate data        corresponding to ≥4 work hours per workday or 75% of average work hours, and no        missing outcome and confounder values. PRIMARY AND SECONDARY OUTCOME MEASURES:        The primary outcome measure was BP. RESULTS: Heart rate reserve was estimated        from ambulatory 24-hour heart rate measures covering 2.5 workdays per participant        (SD 1.0 day). Age significantly moderated the association between RAW and BP.        Mean intensity and duration of high RAW (≥30% heart rate reserve) showed positive        associations with diastolic BP and negative associations with pulse pressure (PP)        among participants ≥47 years old. Tendencies towards negative associations        between RAW and BP were seen among participants <47 years old. CONCLUSIONS: Mean        intensity and duration of RAW increased diastolic BP among participants ≥47 years        old. Negative associations with PP may be due to healthy worker selection bias.        Prevention of hypertension should consider reductions in RAW for ageing workers.",2019 Sep 24,9,9,e029713,10.1136/bmjopen-2019-029713
,Effects of personality on overtime work: a cross-sectional pilot study among        Japanese white-collar workers.,"['Uchida M', 'Kaneko M', 'Kawa S']",BMC Res Notes,"BACKGROUND: As detailed associations between personality and long work hours are        unclear, we assessed associations between personality dimensions and overtime        work among Japanese white-collar workers. METHODS: From records of hours worked        over 12 months by 267 office workers in an organization within the service        industry, average overtime work hours per month and occurrence of excessive        overtime was determined for each worker. Excessive overtime was defined as >  45        overtime work hours per month for at least one month. Responses to a        questionnaire assessing socio-demographic and workplace-related factors and the        Big Five personality test were analyzed. Associations between personality factors        and overtime work were assessed by multivariate logistic regression analysis.        RESULTS: Low Extraversion was associated with excessive overtime work (OR 2.02,        95%CI 1.02 - 4.02, P =  0.04). CONCLUSIONS: It is suggested that workers with low        Extraversion can't share work when busy to avoid excessive overtime. Personality        factors should be considered in studies evaluating work time. Moreover,        strengthening communication among workers with low Extraversion may reduce        excessive overtime work and associated health problems. FAU - Uchida, Mitsuo",2014 Mar 27,7,,180,10.1186/1756-0500-7-180
,Musculoskeletal disorders among Thai women in construction-related work.,"['Hanklang S', 'Kaewboonchoo O', 'Silpasuwan P', 'Mungarndee SS']",Asia Pac J Public Health,"A cross-sectional study was conducted to determine the prevalence of        musculoskeletal disorder symptoms and its risk factors among women rebar workers.        A simple random sampling method was used and data were collected by face-to-face        interview and ergonomic assessment from February to March 2011. A total of 272        women rebar workers with at least 6 months' job experience participated in this        study. The findings revealed that 57.7% of workers reported musculoskeletal        disorder symptoms with low back and shoulders as the most common body parts        affected (46.0%). Multiple logistic regression analysis indicated 2 variables        that are significantly associated with musculoskeletal disorders: prolonged        working hours (adjusted odds ratio = 7.63; 95% confidence interval = 2.06-28.31)        and awkward posture (adjusted odds ratio = 43.79; 95% confidence interval =        17.09-112.20). The high prevalence of musculoskeletal disorders among women rebar        workers suggests that an appropriate ergonomic workstation design and ergonomic        training for women rebar workers are necessary. FAU - Hanklang, Suda",2014 Mar,26,2,196-202,10.1177/1010539512466429
,Risk factors associated with self-reported musculoskeletal pain among short and        long distance industrial gas delivery truck drivers.,"['Sekkay F', 'Imbeau D', 'Chinniah Y', 'Dubé PA', 'de Marcellis-Warin N', 'Beauregard N', 'Trépanier M']",Appl Ergon,"AIM: This study investigated and compared the associations between self-reported        exposures to individual as well as work-related physical and psychosocial risk        factors for musculoskeletal (MS) disorders and the prevalence of MS symptoms in        different body areas among short- (P&D) and long-distance (Bulk delivery) truck        drivers working for the same large gas delivery company in Canada. METHODS: 123        truck drivers nationwide participated in this questionnaire-based cross-sectional        study. Univariate and multivariate logistic regression analyses were performed.        RESULTS: 43.1% of drivers reported MS pain in at least one body area over the        past 12 months and 26.8% over the past 7 days. Bulk drivers had a significantly        higher prevalence of MS pain than P&D drivers for both periods. When P&D and Bulk        drivers were pooled together, belonging to the Bulk subgroup emerged as the        strongest factor for low back pain (OR = 8.45, p = 0.002), for shoulder pain        (OR = 3.70, p = 0.027) and for MS pain in any body area (OR = 4.05, p = 0.006).        In Bulk drivers ""High effort-reward imbalance"" was strongly associated with MS        pain in any body area (OR = 6.47, p = 0.01), with shoulder pain (OR = 4.95,        p = 0.016), and with low back pain (OR = 4.51, p = 0.02). In P&D drivers MS pain        in any body area was strongly associated with ""Working with hands above        shoulders"" (OR = 6.58, p = 0.009) and ""Whole-body vibration"" (OR = 5.48,        p = 0.018), while shoulder pain was strongly associated with ""Hand-arm vibration""        (OR = 7.27, p = 0.041). CONCLUSIONS: Prevalence of MS pain was higher among        industrial gas delivery truck drivers than in the general Quebec male worker        population, and higher for Bulk drivers compared to P&D drivers. MS pain in Bulk        drivers was mainly associated with psychosocial risk factors and lifestyle; MS        pain in P&D drivers was mainly associated with physical risk factors.",2018 Oct,72,,69-87,10.1016/j.apergo.2018.05.005
