J,"Shi, C; Rothrock, L",,,,"Shi, Chao; Rothrock, Ling",,,Validating an abnormal situation prediction model for smart manufacturing in the oil refining industry,APPLIED ERGONOMICS,,,English,Article,,,,,,Statistical modeling prediction; Interactive devices; Control room; Eye-tracking,CONTROL ROOM OPERATORS; EYE-TRACKING; PETROLEUM; PROGRAM; SAFETY,"Human beings play an important role in a smart manufacturing economy. The repetitive and cognitive demanding task operations of smart manufacturing require the development of system models for measuring and predicting human performance, including oil refinery monitoring tasks. The main objective of this research was to validate the generalizability of a mathematical model for the prediction of refinery operators' detection of abnormal events. Moreover, we examined operators' visual behaviors in response to abnormal situations at different ages and with different task loads, task complexities, and input devices. We found that participants had lower mean fixation durations, total fixation numbers, and fixation/saccade ratios when they were in the condition of a touchscreen device. Moreover, we found that older adults had higher mean saccade durations and saccade amplitudes when they were in the condition of a touchscreen device. Finally, the statistical model borrowed from our prior paper was found to be generalizable to different task loads and age groups for the prediction of operators' detection of abnormal events. Our results showed that visual behaviors can indicate specific internal states of participants, including their cognitive workload, attention, and situation awareness in a real-time manner. The findings provide additional support for the value of using visual behavior to predict responsiveness of oil refinery operators and for future applications of smart manufacturing monitoring systems.","[Shi, Chao] SUNY Binghamton, Dept Syst Sci & Ind Engn, 4400 Vestal Pkwy East, Binghamton, NY 13902 USA; [Rothrock, Ling] Penn State Univ, Harold & Inge Marcus Dept Ind & Mfg Engn, 310 Leonhard Bldg, University Pk, PA 16802 USA","State University of New York (SUNY) System; Binghamton University, SUNY; Pennsylvania Commonwealth System of Higher Education (PCSHE); Pennsylvania State University; Pennsylvania State University - University Park","Shi, C (corresponding author), SUNY Binghamton, Dept Syst Sci & Ind Engn, 4400 Vestal Pkwy East, Binghamton, NY 13902 USA.",cshi@binghamton.edu; lxr28@psu.edu,"Shi, Chao/KWU-4188-2024","Rothrock, Ling/0000-0001-7614-5132",Abnormal Situation Management Consortium Support,Abnormal Situation Management Consortium Support,This work was supported by Abnormal Situation Management Consortium Support.,,34,4,4,5,18,ELSEVIER SCI LTD,OXFORD,"THE BOULEVARD, LANGFORD LANE, KIDLINGTON, OXFORD OX5 1GB, OXON, ENGLAND",0003-6870,1872-9126,,APPL ERGON,Appl. Ergon.,MAY,2022,101,,,,,,,,103697,10.1016/j.apergo.2022.103697,http://dx.doi.org/10.1016/j.apergo.2022.103697,,22-Jan,7,"Engineering, Industrial; Ergonomics; Psychology, Applied",Science Citation Index Expanded (SCI-EXPANDED); Social Science Citation Index (SSCI),Engineering; Psychology,3F3KE,35101692,Green Submitted,,,11/13/2024,WOS:000830568400011,View Full Record in Web of Science
J,"Wang, AE; Wang, JY; Shi, WX; He, DB",,,,"Wang, Ange; Wang, Jiyao; Shi, Wenxin; He, Dengbo",,,Cognitive Workload Estimation in Conditionally Automated Vehicles Using Transformer Networks Based on Physiological Signals,TRANSPORTATION RESEARCH RECORD,,,English,Article; Early Access,,,,,,cognitive load; conditional automation; deep learning; transformer encoder; physiological signals,HEART-RATE; DISTRACTION,"Though driving automation promises to improve driving safety, drivers are still required to be ready to retake control in conditionally automated vehicles, which are defined by the Society of Automotive Engineers (SAE) as SAE L3 vehicles. Thus, drivers' states can still affect driving safety in SAE L3 vehicles. Previous research found that a high cognitive load may impair drivers' takeover performance. Thus, it is still necessary to estimate drivers' cognitive load in SAE L3 vehicles. However, existing driver cognitive load estimation algorithms mostly focus on vehicles with a lower level of driving automation (e.g., SAE L0), which may not be relevant when estimating driver states in SAE L3 vehicles, given that drivers' responsibilities are different, and several commonly used measures (e.g., driving performance) are unavailable when drivers are not continuously controlling the vehicle. Further, previous driver cognitive load estimation algorithms rarely considered the temporal information in the input features. Thus, we proposed a deep-learning algorithm to estimate driver cognitive load in SAE L3 vehicles, which integrated multiple physiological features (i.e., electrocardiogram, electrodermal activity, respiration) and considered the temporal correlation of the data using a transformer-encoder-based network. The performance of our algorithm was compared with baseline models on an open data set. Results showed that our algorithm outperformed baseline models and achieved an accuracy of 94.4% using within-subject data partition (proportionally splitting data from the same subject into the training and testing data sets) and an accuracy of 89% using across-subjects data partition (dividing the training and testing data sets based on individual subjects).","[Wang, Ange; Wang, Jiyao; He, Dengbo] Hong Kong Univ Sci & Technol Guangzhou, Intelligent Transportat Thrust, Syst Hub, Hong Kong, Peoples R China; [Shi, Wenxin; He, Dengbo] Hong Kong Univ Sci & Technol Guangzhou, Robot & Autonomous Syst Thrust, Syst Hub, Hong Kong, Peoples R China; [He, Dengbo] Hong Kong Univ Sci & Technol, Dept Civil & Environm Engn, Hong Kong, Peoples R China; [He, Dengbo] HKUST Shenzhen Hong Kong Collaborat Innovat Res In, Shenzhen, Peoples R China",Hong Kong University of Science & Technology,"He, DB (corresponding author), Hong Kong Univ Sci & Technol Guangzhou, Intelligent Transportat Thrust, Syst Hub, Hong Kong, Peoples R China.;He, DB (corresponding author), Hong Kong Univ Sci & Technol Guangzhou, Robot & Autonomous Syst Thrust, Syst Hub, Hong Kong, Peoples R China.;He, DB (corresponding author), Hong Kong Univ Sci & Technol, Dept Civil & Environm Engn, Hong Kong, Peoples R China.;He, DB (corresponding author), HKUST Shenzhen Hong Kong Collaborat Innovat Res In, Shenzhen, Peoples R China.",dengbohe@hkust-gz.edu.cn,"He, Dengbo/GZA-9228-2022","Wang, Jiyao/0000-0002-0743-0121",Natural Science Foundation of Guangdong Province of China [2024A1515010392]; National Natural Science Foundation of China [52202425]; Project of Hetao Shenzhen-Hong Kong Science and Technology Innovation Cooperation Zone [HZQB-KCZYB-2020083]; Technology Program City-University Joint Funding Project [2023A03J0001],Natural Science Foundation of Guangdong Province of China(National Natural Science Foundation of Guangdong Province); National Natural Science Foundation of China(National Natural Science Foundation of China (NSFC)); Project of Hetao Shenzhen-Hong Kong Science and Technology Innovation Cooperation Zone; Technology Program City-University Joint Funding Project,"The author(s) disclosed receipt of the following financial support for the research, authorship, and/or publication of this article: This work was supported by the Natural Science Foundation of Guangdong Province of China (2024A1515010392), and partially by the National Natural Science Foundation of China (grant no. 52202425), the Project of Hetao Shenzhen-Hong Kong Science and Technology Innovation Cooperation Zone (HZQB-KCZYB-2020083), and Technology Program City-University Joint Funding Project (No. 2023A03J0001).",,52,2,2,9,9,SAGE PUBLICATIONS INC,THOUSAND OAKS,"2455 TELLER RD, THOUSAND OAKS, CA 91320 USA",0361-1981,2169-4052,,TRANSPORT RES REC,Transp. Res. Record,2024 JUN 10,2024,,,,,,,,,,10.1177/03611981241250023,http://dx.doi.org/10.1177/03611981241250023,,24-Jun,14,"Engineering, Civil; Transportation; Transportation Science & Technology",Science Citation Index Expanded (SCI-EXPANDED),Engineering; Transportation,TP1E6,,,,,11/13/2024,WOS:001242364700001,View Full Record in Web of Science
J,"Leote, J; Castellote, JM; Casanova-Molla, J; Navarro-Otano, J; Nunes, RG; Ferreira, HA; Valls-Sole, J",,,,"Leote, Joao; Castellote, Juan M.; Casanova-Molla, Jordi; Navarro-Otano, Judith; Nunes, Rita G.; Ferreira, Hugo A.; Valls-Sole, Josep",,,Motor preparation in picture naming tasks,BRAIN AND LANGUAGE,,,English,Article,,,,,,StartReact effect; Speech; Reaction time; Cognitive task,REACTION-TIME; RECURRING UTTERANCES; BASAL GANGLIA; INTERSENSORY FACILITATION; LANGUAGE PRODUCTION; AUDITORY STARTLE; PERSPECTIVES; ACTIVATION; EXECUTION; APHASIA,"In certain circumstances, words can be uttered as an involuntary action. We hypothesize that, once pronunciation of a word is fully prepared it can be triggered as a reflex with no need for cortical processing. We used modified protocols of picture naming tasks, with different levels of cognitive demands, to measure reaction time to word pronunciation (RTWP). In test trials, picture presentation was accompanied by a startling auditory stimulus (SAS). When one and the same picture was repeatedly shown, SAS shortened RTWP by about 30% (StartReact effect), which did not occur when random pictures were shown. If subjects were led to learn which picture was to appear after repeated presentation of three pictures in sequence, they exhibited again the StartReact effect. We conclude that word pronunciation may be fully prepared for execution in absence of cognitive demands. However, the StartReact effect is inhibited during cognitive tasks.","[Leote, Joao; Ferreira, Hugo A.] Univ Lisbon, Inst Biofis & Engn Biomed, Fac Ciencias, Lisbon, Portugal; [Leote, Joao] Univ Lisbon, Fac Med, Lisbon, Portugal; [Leote, Joao] Hosp Garcia de Orta, Neurosurg Dept, Almada, Portugal; [Castellote, Juan M.] Univ Complutense Madrid, Dept Phys Med & Rehabil, Madrid, Spain; [Castellote, Juan M.] Inst Salud Carlos, Natl Sch Occupat Med, Madrid, Spain; [Casanova-Molla, Jordi; Navarro-Otano, Judith; Valls-Sole, Josep] Univ Barcelona, EMG & Motor Control Unit, Neurol Dept, Hosp Clin, Barcelona, Spain; [Casanova-Molla, Jordi; Navarro-Otano, Judith; Valls-Sole, Josep] Univ Barcelona, IDIBAPS Inst Invest August Pi i Sunyer, Fac Med, Barcelona, Spain; [Nunes, Rita G.] Univ Lisbon, Inst Super Tecn, Dept Bioengn, Lisbon, Portugal; [Nunes, Rita G.] Univ Lisbon, Inst Super Tecn, Inst Syst & Robot ISR IST, LARSyS, Lisbon, Portugal",Universidade de Lisboa; Universidade de Lisboa; Hospital Garcia de Orta; Complutense University of Madrid; Instituto de Salud Carlos III; Escuela Nacional de Medicina del Trabajo (ENMT); University of Barcelona; Hospital Clinic de Barcelona; University of Barcelona; Hospital Clinic de Barcelona; IDIBAPS; Universidade de Lisboa; Universidade de Lisboa,"Leote, J (corresponding author), Univ Lisbon, Inst Biofis & Engn Biomed, Fac Ciencias, Lisbon, Portugal.",jlleotte@gmail.com,"Castellote, Juan/ABG-4178-2020; Casanova-Molla, Jordi/S-2375-2018; Nunes, Rita/I-6659-2013; Ferreira, Hugo/I-8538-2015; Leote Rebocho, Joao Carlos/E-4655-2018","Navarro-Otano, Judith/0000-0002-2949-947X; Nunes, Rita/0000-0001-7425-5717; Ferreira, Hugo/0000-0002-4323-3942; Leote Rebocho, Joao Carlos/0000-0001-9659-8438","Fundacao Calouste Gulbenkian/Faculdade Medicina da Universidade de Lisboa (Programa Educacao pela Ciencia, GAPIC/FMUL) [2015005]; Instituto de Salud Carlos III [ESPY 112-18]; FIS grant [PI130526]","Fundacao Calouste Gulbenkian/Faculdade Medicina da Universidade de Lisboa (Programa Educacao pela Ciencia, GAPIC/FMUL); Instituto de Salud Carlos III(Instituto de Salud Carlos IIISpanish Government); FIS grant","JL was partially supported by the Fundacao Calouste Gulbenkian/Faculdade Medicina da Universidade de Lisboa (grant 2015005 of Programa Educacao pela Ciencia, GAPIC/FMUL); JMC by the Instituto de Salud Carlos III (grant ESPY 112-18) and JVS by FIS grant PI130526.",,56,4,4,1,8,ACADEMIC PRESS INC ELSEVIER SCIENCE,SAN DIEGO,"525 B ST, STE 1900, SAN DIEGO, CA 92101-4495 USA",0093-934X,1090-2155,,BRAIN LANG,Brain Lang.,MAY-JUL,2018,180,,,,,,24,30,,10.1016/j.bandl.2018.04.002,http://dx.doi.org/10.1016/j.bandl.2018.04.002,,,7,"Audiology & Speech-Language Pathology; Linguistics; Neurosciences; Psychology, Experimental",Science Citation Index Expanded (SCI-EXPANDED); Social Science Citation Index (SSCI),Audiology & Speech-Language Pathology; Linguistics; Neurosciences & Neurology; Psychology,GJ6XX,29677561,,,,11/13/2024,WOS:000435528800004,View Full Record in Web of Science
J,"Martin, CD; Nozari, N",,,,"Martin, Clara D.; Nozari, Nazbanou",,,Language control in bilingual production: Insights from error rate and error type in sentence production,BILINGUALISM-LANGUAGE AND COGNITION,,,English,Article,,,,,,bilingual sentence production; bilingual language control; cognate effect; phonological; lexical interference; speech errors,SPOKEN WORD PRODUCTION; SPEECH PRODUCTION; SEMANTIC INTERFERENCE; LEXICAL ACCESS; SELECTION; COMPETITION; INHIBITION; ACTIVATION; BRAIN; FACILITATION,"Most research showing that cognates are named faster than non-cognates has focused on isolated word production which might not realistically reflect cognitive demands in sentence production. Here, we explored whether cognates elicit interference by examining error rates during sentence production, and how this interference is resolved by language control mechanisms. Twenty highly proficient Spanish-English bilinguals described visual scenes with sentence structures 'NP1-verb-NP2' (NP = noun-phrase). Half the nouns and half the verbs were cognates and two manipulations created high control demands. Both situations that demanded higher inhibitory control pushed the cognate effect from facilitation towards interference. These findings suggest that cognates, similar to phonologically similar words within a language, can induce not only facilitation but robust interference.","[Martin, Clara D.] Basque Ctr Cognit Brain & Language, Paseo Mikeletegi 69,2nd, San Sebastian 20009, Spain; [Martin, Clara D.] Basque Fdn Sci, Ikerbasque, Bilbao, Spain; [Nozari, Nazbanou] Carnegie Mellon Univ, Dept Psychol, Pittsburgh, PA 15213 USA",Basque Foundation for Science; Carnegie Mellon University,"Martin, CD (corresponding author), Basque Ctr Cognit Brain & Language, Paseo Mikeletegi 69,2nd, San Sebastian 20009, Spain.",c.martin@bcbl.eu,"Martin, Clara/B-4563-2012",,"Therapeutic Cognitive Neuroscience Fund; Spanish Ministry of Economy and Competitiveness [SEV-2015-490, PSI2017-82941-P, ERC2018-092833]; Basque Government [PIBA18-29]; European Research Council [ERC-2018-COG-092833]; NSF [NSF BCS-1949631]",Therapeutic Cognitive Neuroscience Fund; Spanish Ministry of Economy and Competitiveness(Spanish Government); Basque Government(Basque Government); European Research Council(European Research Council (ERC)); NSF(National Science Foundation (NSF)),"We thank Michael Freund and Nicholas McCloskey for their help with data collection. This work was supported in part by the Therapeutic Cognitive Neuroscience Fund endowed to the Cognitive Neurology division of the Neurology Department at Johns Hopkins University. CY.D. Martin was supported by the Spanish Ministry of Economy and Competitiveness (SEV-2015-490; PSI2017-82941-P; Europa-Excelencia ERC2018-092833), the Basque Government (PIBA18-29), and the European Research Council (ERC-2018-COG-092833). N. Nozari was also supported by a NSF grant (NSF BCS-1949631).",,82,7,7,2,16,CAMBRIDGE UNIV PRESS,NEW YORK,"32 AVENUE OF THE AMERICAS, NEW YORK, NY 10013-2473 USA",1366-7289,1469-1841,,BILING-LANG COGN,Biling.-Lang. Cogn.,MAR,2021,24,2,,,,,374,388,PII S1366728920000590,10.1017/S1366728920000590,http://dx.doi.org/10.1017/S1366728920000590,,,15,"Linguistics; Psychology, Experimental",Social Science Citation Index (SSCI),Linguistics; Psychology,QX5IR,,Green Submitted,,,11/13/2024,WOS:000629380400012,View Full Record in Web of Science
J,"Wojtak, W; Ferreira, F; Vicente, P; Louro, L; Bicho, E; Erlhagen, W",,,,"Wojtak, Weronika; Ferreira, Flora; Vicente, Paulo; Louro, Luis; Bicho, Estela; Erlhagen, Wolfram",,,A neural integrator model for planning and value-based decision making of a robotics assistant,NEURAL COMPUTING & APPLICATIONS,,,English,Article,,,,,,Dynamic Neural Field; Neural integrator; Assembly robot; Value-based decision making; Sequence learning,ARTIFICIAL COGNITION; MATCHING BEHAVIOR; PREFRONTAL CORTEX; REPRESENTATION; NEURODYNAMICS; ARCHITECTURE; AUTOMATION; MECHANISMS; STABILITY; DYNAMICS,"Modern manufacturing and assembly environments are characterized by a high variability in the built process which challenges human-robot cooperation. To reduce the cognitive workload of the operator, the robot should not only be able to learn from experience but also to plan and decide autonomously. Here, we present an approach based on Dynamic Neural Fields that apply brain-like computations to endow a robot with these cognitive functions. A neural integrator is used to model the gradual accumulation of sensory and other evidence as time-varying persistent activity of neural populations. The decision to act is modeled by a competitive dynamics between neural populations linked to different motor behaviors. They receive the persistent activation pattern of the integrators as input. In the first experiment, a robot learns rapidly by observation the sequential order of object transfers between an assistant and an operator to subsequently substitute the assistant in the joint task. The results show that the robot is able to proactively plan the series of handovers in the correct order. In the second experiment, a mobile robot searches at two different workbenches for a specific object to deliver it to an operator. The object may appear at the two locations in a certain time period with independent probabilities unknown to the robot. The trial-by-trial decision under uncertainty is biased by the accumulated evidence of past successes and choices. The choice behavior over a longer period reveals that the robot achieves a high search efficiency in stationary as well as dynamic environments.","[Wojtak, Weronika; Ferreira, Flora; Erlhagen, Wolfram] Univ Minho, Res Ctr Math, P-4800058 Guimaraes, Portugal; [Wojtak, Weronika; Vicente, Paulo; Louro, Luis; Bicho, Estela] Univ Minho, Res Ctr Algoritmi, P-4800058 Guimaraes, Portugal",Universidade do Minho; Universidade do Minho,"Wojtak, W (corresponding author), Univ Minho, Res Ctr Math, P-4800058 Guimaraes, Portugal.;Wojtak, W (corresponding author), Univ Minho, Res Ctr Algoritmi, P-4800058 Guimaraes, Portugal.",w.wojtak@dei.uminho.pt; wolfram.erlhagen@math.uminho.pt,"Louro, Luís/LDF-3933-2024; Ferreira, Flora/D-5772-2017; W, Weronika/KHY-0044-2024; Bicho, Estela/M-5241-2013","Louro, Luis Filipe/0000-0003-1708-8881; Ferreira, Flora/0000-0003-1558-7230; Vicente, Paulo Sergio/0000-0003-3474-9709; Wojtak, Weronika/0000-0001-9515-2397; Bicho, Estela/0000-0003-2715-4037; Erlhagen, Wolfram/0000-0002-8150-3587","FCT [PD/BD/128183/2016, SFRH/BD/124912/2016, PTDC/MAT-APL/31393/2017]; research centre CMAT [UID/MAT/00013/2020]; Fundação para a Ciência e a Tecnologia [PTDC/MAT-APL/31393/2017, SFRH/BD/124912/2016, PD/BD/128183/2016] Funding Source: FCT",FCT(Fundacao para a Ciencia e a Tecnologia (FCT)); research centre CMAT; Fundação para a Ciência e a Tecnologia(Fundacao para a Ciencia e a Tecnologia (FCT)),"The work received financial support from FCT through the PhD fellowships PD/BD/128183/2016 and SFRH/BD/124912/2016, the project Neurofield (PTDC/MAT-APL/31393/2017) and the research centre CMAT within the project UID/MAT/00013/2020.",,65,17,18,0,11,SPRINGER LONDON LTD,LONDON,"236 GRAYS INN RD, 6TH FLOOR, LONDON WC1X 8HL, ENGLAND",0941-0643,1433-3058,,NEURAL COMPUT APPL,Neural Comput. Appl.,APR,2021,33,8,,,,,3737,3756,,10.1007/s00521-020-05224-8,http://dx.doi.org/10.1007/s00521-020-05224-8,,20-Aug,20,"Computer Science, Artificial Intelligence",Science Citation Index Expanded (SCI-EXPANDED); Social Science Citation Index (SSCI),Computer Science,RA7BC,,,,,11/13/2024,WOS:000557119600001,View Full Record in Web of Science
C,"Mayer, A; Combe, T; Chardonnet, JR; Ovtcharova, J",,"DePaolis, LT; Arpaia, P; Sacco, M",,"Mayer, Anjela; Combe, Theo; Chardonnet, Jean-Remy; Ovtcharova, Jivka",,,Asynchronous Manual Work in Mixed Reality Remote Collaboration,"EXTENDED REALITY, XR SALENTO 2022, PT II",Lecture Notes in Computer Science,,English,Proceedings Paper,1st International Conference on Extended Reality (XR Salento),"JUL 06-08, 2022","Lecce, ITALY",,,Asynchronous remote collaboration; Collaborative Virtual Environments; Mixed Reality; Asymmetric collaboration,,"Research in Collaborative Virtual Environments (CVEs) is becoming more and more significant with increasing accessibility of Virtual Reality (VR) and Augmented Reality (AR) technology, additionally reinforced by the increasing demand for remote collaboration groupware. While the research is focusing on methods for synchronous remote collaboration, asynchronous remote collaboration remains a niche. Nevertheless, future CVEs should support both paradigms of collaborative work, since asynchronous collaboration has as well its benefits, for instance a more flexible time-coordination. In this paper we present a concept of recording and later playback of highly interactive collaborative tasks in Mixed Reality (MR). Furthermore, we apply the concept in an assembly training scenario from the manufacturing industry and test it during pilot user experiments. The pilot study compared two modalities, the first one with a manufacturing manual, and another using our concept and featuring a ghost avatar. First results revealed no significant differences between both modalities in terms of time completion, hand movements, cognitive workload and usability. Some differences were not expected, however, these results and the feedback brought by the participants provide insights to further develop our concept.","[Mayer, Anjela; Combe, Theo; Ovtcharova, Jivka] Karlsruhe Inst Technol KIT, Inst Informat Management Engn, Karlsruhe, Germany; [Combe, Theo; Chardonnet, Jean-Remy] HESAM Univ, Arts & Metiers Inst Technol, LISPEN, Chalon Sur Saone, France",Helmholtz Association; Karlsruhe Institute of Technology; heSam Universite,"Mayer, A (corresponding author), Karlsruhe Inst Technol KIT, Inst Informat Management Engn, Karlsruhe, Germany.",anjela.mayer@kit.edu,"Chardonnet, Jean-Rémy/W-4502-2019; Mayer, Anjela/JWA-6864-2024","Mayer, Anjela/0000-0002-5426-3020; Chardonnet, Jean-Remy/0000-0002-8926-1359; Combe, Theo/0000-0003-1209-5580",,,,,38,4,4,1,10,SPRINGER INTERNATIONAL PUBLISHING AG,CHAM,"GEWERBESTRASSE 11, CHAM, CH-6330, SWITZERLAND",0302-9743,1611-3349,978-3-031-15553-6; 978-3-031-15552-9,LECT NOTES COMPUT SC,,,2022,13446,,,,,,17,33,,10.1007/978-3-031-15553-6_2,http://dx.doi.org/10.1007/978-3-031-15553-6_2,,,17,"Computer Science, Interdisciplinary Applications; Computer Science, Software Engineering; Computer Science, Theory & Methods",Conference Proceedings Citation Index - Science (CPCI-S),Computer Science,BU2NX,,,,,11/13/2024,WOS:000886159800002,View Full Record in Web of Science
