J,"Salis, C; DeDe, G",,,,"Salis, Christos; DeDe, Gayle",,,Sentence Production in a Discourse Context in Latent Aphasia: A Real-Time Study,AMERICAN JOURNAL OF SPEECH-LANGUAGE PATHOLOGY,,,English,Article,,,,,,,ADULT AGE-DIFFERENCES; PROCESSING-SPEED; PROPOSITIONAL SPEECH; PLANNING UNITS; LANGUAGE; PAUSES; INFORMATION; MEMORY; SPEAKERS; STROKE,"Purpose: The purpose of this study was to improve our understanding as to which factors determine online, spoken sentence production abilities of adults with latent aphasia in a discourse context. Method: Discourse samples of the story of Cinderella elicited from Aphasia-Bank were analyzed with speech analysis software. Participants comprised people with latent and anomic aphasia as well as neurotypical controls (10 per group). Durations of pauses (silent and filled) were analyzed according to (a) the location they occurred (between or within sentences), (b) the syntactic complexity of sentences (simple, complex), and (c) sentence length (number of words). Statistical comparisons were conducted using mixed-effect models. Results: The two clinical groups (latent and anomic) differed from controls in the duration of pauses, both between and within sentences. Syntactic complexity did not exert an effect on either of the two clinical groups as compared with controls. As compared with controls, both clinical groups paused more before long in comparison with short sentences. Conclusion: Reduction in processing speed, which affects the ability to simultaneously maintain multiple linguistic and other cognitive demands associated with planning and monitoring of utterances, is a major factor that compromises sentence production in spoken discourse in latent aphasia.","[Salis, Christos] Newcastle Univ, Speech & Language Sci, Newcastle Upon Tyne, Tyne & Wear, England; [DeDe, Gayle] Temple Univ, Dept Commun Sci & Disorders, Philadelphia, PA 19122 USA",Newcastle University - UK; Pennsylvania Commonwealth System of Higher Education (PCSHE); Temple University,"Salis, C (corresponding author), Newcastle Univ, Speech & Language Sci, Newcastle Upon Tyne, Tyne & Wear, England.",christos.salis@ncl.ac.uk,,"Salis, Christos/0000-0002-7212-127X",,,,,100,5,5,0,3,AMER SPEECH-LANGUAGE-HEARING ASSOC,ROCKVILLE,"2200 RESEARCH BLVD, #271, ROCKVILLE, MD 20850-3289 USA",1058-0360,1558-9110,,AM J SPEECH-LANG PAT,Am. J. Speech-Lang. Pathol.,MAY,2022,31,3,,,,,1284,1296,,10.1044/2022_AJSLP-21-00232,http://dx.doi.org/10.1044/2022_AJSLP-21-00232,,,13,Audiology & Speech-Language Pathology; Linguistics; Rehabilitation,Science Citation Index Expanded (SCI-EXPANDED); Social Science Citation Index (SSCI),Audiology & Speech-Language Pathology; Linguistics; Rehabilitation,1I4ON,35363996,Green Submitted,,,11/13/2024,WOS:000797209200016,View Full Record in Web of Science
J,"Knisely, BM; Joyner, JS; Rutkowski, AM; Wong, M; Barksdale, S; Hotham, H; Kharod, K; Vaughn-Cooke, M",,,,"Knisely, Benjamin M.; Joyner, Janell S.; Rutkowski, Anthony M.; Wong, Matthew; Barksdale, Samuel; Hotham, Hayden; Kharod, Kush; Vaughn-Cooke, Monifa",,,A cognitive decomposition to empirically study human performance in control room environments,INTERNATIONAL JOURNAL OF HUMAN-COMPUTER STUDIES,,,English,Article,,,,,,Workstation; Workload; Human-machine system; Autonomous; Cognitive task analysis; Pupillometry,BLOOMS TAXONOMY; TASK-ANALYSIS; PUPIL-SIZE; WORKLOAD; AUTOMATION; INSTRUMENT; VIGILANCE; SYSTEM,"Monitoring tasks in control room environments require operators to perform various mental and physical subtasks in series and simultaneously over long periods of time with minimal error. These tasks vary in cognitive complexity, ranging from low-level sensory processing to high-level decision making. Cognitive load, a measure of the effort required by the working memory, can serve as an indicator of tasks that may have higher risk of error. Task decomposition models for cognitive complexity can be combined with objective and subjective measures of workload to measure human performance in response to control room stimuli. In this study, we demonstrate the effectiveness of a cognitive task analysis approach to structure the design of experiments for the purpose of evaluating human performance in control room simulated use activities. Participants completed monitoring tasks in a simulated unmanned aerial vehicle (UAV) control room that required the completion of tasks ranging in cognitive complexity. Performance measures taken during the study were used to validate the breakdown of tasks complexity, and to identify potential sources of human error in workstation monitoring tasks. These findings can be linked to design specifications for workstation optimization. Results indicated that the task breakdown appropriately represented the use-case scenario, and the classification model adequately captured differences in cognitive workload experienced by participants. This research has broad implications on complex system design validation, providing a structure to achieve cognitive depth for the evaluation of human performance and subsequent design risk mitigation.","[Knisely, Benjamin M.; Joyner, Janell S.; Rutkowski, Anthony M.; Wong, Matthew; Barksdale, Samuel; Hotham, Hayden; Kharod, Kush; Vaughn-Cooke, Monifa] Univ Maryland, Dept Mech Engn, 1210 Kim Bldg, College Pk, MD 20742 USA",University System of Maryland; University of Maryland College Park,"Knisely, BM (corresponding author), Univ Maryland, Dept Mech Engn, 1210 Kim Bldg, College Pk, MD 20742 USA.",bknisely@terpmail.umd.edu; jjoyner2@terpmail.umd.edu; kkharod@terpmail.umd.edu; mvc@umd.edu,"Vaughn-Cooke, Monifa/JRX-4059-2023","Vaughn-Cooke, Monifa/0000-0003-3577-3321; Knisely, Benjamin/0000-0001-8450-3198",Naval Air Systems Command [N004211820001]; Nuclear Regulatory Commission [NRCHQ6017G0022],Naval Air Systems Command; Nuclear Regulatory Commission,This work was supported by the Naval Air Systems Command [Grant #N004211820001] and the Nuclear Regulatory Commission [Grant #NRCHQ6017G0022].,,76,11,11,4,41,ACADEMIC PRESS LTD- ELSEVIER SCIENCE LTD,LONDON,"24-28 OVAL RD, LONDON NW1 7DX, ENGLAND",1071-5819,1095-9300,,INT J HUM-COMPUT ST,Int. J. Hum.-Comput. Stud.,SEP,2020,141,,,,,,,,102438,10.1016/j.ijhcs.2020.102438,http://dx.doi.org/10.1016/j.ijhcs.2020.102438,,,13,"Computer Science, Cybernetics; Ergonomics; Psychology, Multidisciplinary",Science Citation Index Expanded (SCI-EXPANDED); Social Science Citation Index (SSCI),Computer Science; Engineering; Psychology,MC7AN,,Bronze,,,11/13/2024,WOS:000543435100004,View Full Record in Web of Science
J,"Moisseinen, N; Särkämö, T; Kauramäki, J; Kleber, B; Sihvonen, AJ; Martínez-Molina, N",,,,"Moisseinen, Nella; Sarkamo, Teppo; Kauramaki, Jaakko; Kleber, Boris; Sihvonen, Aleksi J.; Martinez-Molina, Noelia",,,Differential effects of ageing on the neural processing of speech and singing production,FRONTIERS IN AGING NEUROSCIENCE,,,English,Article,,,,,,ageing; language; music; vocal production; fMRI; hemispheric laterality,AGE-RELATED-CHANGES; BRAIN ACTIVATION; MOTOR CONTROL; OLDER-ADULTS; LANGUAGE; LATERALIZATION; CORTEX; COGNITION; MEMORY; MUSIC,"BackgroundUnderstanding healthy brain ageing has become vital as populations are ageing rapidly and age-related brain diseases are becoming more common. In normal brain ageing, speech processing undergoes functional reorganisation involving reductions of hemispheric asymmetry and overactivation in the prefrontal regions. However, little is known about how these changes generalise to other vocal production, such as singing, and how they are affected by associated cognitive demands.MethodsThe present cross-sectional fMRI study systematically maps the neural correlates of vocal production across adulthood (N=100, age 21-88 years) using a balanced 2x3 design where tasks varied in modality (speech: proverbs / singing: song phrases) and cognitive demand (repetition / completion from memory / improvisation).ResultsIn speech production, ageing was associated with decreased left pre- and postcentral activation across tasks and increased bilateral angular and right inferior temporal and fusiform activation in the improvisation task. In singing production, ageing was associated with increased activation in medial and bilateral prefrontal and parietal regions in the completion task, whereas other tasks showed no ageing effects. Direct comparisons between the modalities showed larger age-related activation changes in speech than singing across tasks, including a larger left-to-right shift in lateral prefrontal regions in the improvisation task.ConclusionThe present results suggest that the brains' singing network undergoes differential functional reorganisation in normal ageing compared to the speech network, particularly during a task with high executive demand. These findings are relevant for understanding the effects of ageing on vocal production as well as how singing can support communication in healthy ageing and neurological rehabilitation.","[Moisseinen, Nella; Sarkamo, Teppo; Kauramaki, Jaakko; Sihvonen, Aleksi J.; Martinez-Molina, Noelia] Univ Helsinki, Ctr Excellence Mus Mind Body & Brain, Dept Psychol & Logoped, Cognit Brain Res Unit,Fac Med, Helsinki, Finland; [Kleber, Boris] Aarhus Univ, Fac Hlth, Ctr Mus Brain, Dept Clin Med, Aarhus, Denmark; [Sihvonen, Aleksi J.] Univ Queensland, Ctr Clin Res, Sch Hlth & Rehabil Sci, Brisbane, Qld, Australia; [Sihvonen, Aleksi J.] Helsinki Univ Hosp, Dept Neurol, Helsinki, Finland; [Martinez-Molina, Noelia] Univ Pompeu Fabra, Ctr Brain & Cognit, Dept Informat & Commun Technol, Barcelona, Spain",University of Helsinki; Aarhus University; University of Queensland; University of Helsinki; Helsinki University Central Hospital; University of Barcelona; Pompeu Fabra University,"Moisseinen, N (corresponding author), Univ Helsinki, Ctr Excellence Mus Mind Body & Brain, Dept Psychol & Logoped, Cognit Brain Res Unit,Fac Med, Helsinki, Finland.",nella.moisseinen@helsinki.fi,"Kauramäki, Jaakko/G-6962-2012; Kleber, Boris/JOK-6000-2023","Martinez-Molina, Noelia/0000-0001-7699-5540; Sihvonen, Aleksi/0000-0002-4501-7338; Kauramaki, Jaakko/0000-0002-6019-7920; Moisseinen, Nella/0000-0003-0697-4925",Finnish Cultural Foundation [00210736]; Academy of Finland [346211]; European Research Council [803466]; European Research Council (ERC) [803466] Funding Source: European Research Council (ERC),Finnish Cultural Foundation(Finnish Cultural FoundationFinnish IT center for science); Academy of Finland(Research Council of Finland); European Research Council(European Research Council (ERC)); European Research Council (ERC)(European Research Council (ERC)),"Financial support for the work was provided by the Finnish Cultural Foundation (grant no. 00210736), Academy of Finland (grant no. 346211), and the European Research Council (grant no. 803466).",,70,0,0,2,9,FRONTIERS MEDIA SA,LAUSANNE,"AVENUE DU TRIBUNAL FEDERAL 34, LAUSANNE, CH-1015, SWITZERLAND",1663-4365,,,FRONT AGING NEUROSCI,Front. Aging Neurosci.,4-Sep,2023,15,,,,,,,,1236971,10.3389/fnagi.2023.1236971,http://dx.doi.org/10.3389/fnagi.2023.1236971,,,20,Geriatrics & Gerontology; Neurosciences,Science Citation Index Expanded (SCI-EXPANDED),Geriatrics & Gerontology; Neurosciences & Neurology,R8QA9,37731954,"gold, Green Published",,,11/13/2024,WOS:001066935800001,View Full Record in Web of Science
J,"Timofeeva, P; Finisguerra, A; D'Argenio, G; García, AM; Carreiras, M; Quinones, I; Urgesi, C; Amoruso, L",,,,"Timofeeva, Polina; Finisguerra, Alessandra; D'Argenio, Giulia; Garcia, Adolfo M.; Carreiras, Manuel; Quinones, Ileana; Urgesi, Cosimo; Amoruso, Lucia",,,Switching off: disruptive TMS reveals distinct contributions of the posterior middle temporal gyrus and angular gyrus to bilingual speech production,CEREBRAL CORTEX,,,English,Article,,,,,,continuous theta burst stimulation; speech production; bilingualism; posterior middle temporal gyrus; angular gyrus,TRANSCRANIAL MAGNETIC STIMULATION; HIGHLY PROFICIENT BILINGUALS; LANGUAGE CONTROL; PARIETAL CORTEX; SEMANTIC REPRESENTATIONS; LEXICALIZATION PROCESS; COGNITIVE FUNCTIONS; WORD PRODUCTION; LESION ANALYSIS; BRAIN,"The role of the left temporoparietal cortex in speech production has been extensively studied during native language processing, proving crucial in controlled lexico-semantic retrieval under varying cognitive demands. Yet, its role in bilinguals, fluent in both native and second languages, remains poorly understood. Here, we employed continuous theta burst stimulation to disrupt neural activity in the left posterior middle-temporal gyrus (pMTG) and angular gyrus (AG) while Italian-Friulian bilinguals performed a cued picture-naming task. The task involved between-language (naming objects in Italian or Friulian) and within-language blocks (naming objects [knife] or associated actions [cut] in a single language) in which participants could either maintain (non-switch) or change (switch) instructions based on cues. During within-language blocks, cTBS over the pMTG entailed faster naming for high-demanding switch trials, while cTBS to the AG elicited slower latencies in low-demanding non-switch trials. No cTBS effects were observed in the between-language block. Our findings suggest a causal involvement of the left pMTG and AG in lexico-semantic processing across languages, with distinct contributions to controlled vs. automatic retrieval, respectively. However, they do not support the existence of shared control mechanisms within and between language(s) production. Altogether, these results inform neurobiological models of semantic control in bilinguals.","[Timofeeva, Polina; Carreiras, Manuel; Amoruso, Lucia] Basque Ctr Cognit Brain & Language BCBL, BCBL, Paseo Mikeletegi 69, 2nd floor, San Sebastian 20009, Spain; [Timofeeva, Polina; Carreiras, Manuel] Univ Basque Country, Doctoral Sch, UPV EHU, Sarriena S-N, Leioa 48940, Spain; [Finisguerra, Alessandra] IRCCS E Medea, Sci Inst, Via Cialdini 29, I-33037 Pasian Di Prato, UD, Italy; [D'Argenio, Giulia; Urgesi, Cosimo] Univ Udine, Lab Cognit Neurosci, Via Margreth 3, I-33100 Udine, Italy; [Garcia, Adolfo M.; Amoruso, Lucia] Univ San Andres, Cognit Neurosci Ctr CNC, Vito Dumas 284, RA-B1644 Buenos Aires, Argentina; [Garcia, Adolfo M.] Univ Calif San Franscisco, Global Brain Hlth Inst GBHI, Parnassus 513, San Francisco, CA 94143 USA; [Garcia, Adolfo M.] Univ Santiago de Chile, Dept Linguist & Literatura, Av Libertador B OHiggins 3363, Santiago 9170022, Chile; [Carreiras, Manuel; Quinones, Ileana; Amoruso, Lucia] Basque Fdn Sci, Ikerbasque, Plaza Euskadi 5, Bilbao 48009, Spain; [Quinones, Ileana] BioGipuzkoa Hlth Res Inst, Neurosci Dept, Paseo Dr Begiristain S-N, San Sebastian 20014, Spain",University of Basque Country; IRCCS Eugenio Medea; University of Udine; Universidad de San Andres Argentina; University of California System; University of California San Francisco; Basque Foundation for Science; Instituto de Investigacion Sanitaria Biogipuzkoa,"Amoruso, L (corresponding author), Basque Ctr Cognit Brain & Language BCBL, BCBL, Paseo Mikeletegi 69, 2nd floor, San Sebastian 20009, Spain.",l.amoruso@bcbl.eu,"Amoruso, Lucía/P-6949-2019; Urgesi, Cosimo/K-4688-2016; García, Adolfo/E-7150-2017; Finisguerra, Alessandra/AAB-9605-2019; Carreiras, Manuel/D-5267-2009; Amoruso, Lucia/V-3127-2017","Amoruso, Lucia/0000-0003-4696-2187","European Union [101025814]; Basque Government [BERC2022-2025]; Spanish State Research Agency through BCBL Severo Ochoa excellence accreditation [CEX2020-001010-S]; Ikerbasque Foundation; Spanish Ministry of Science and Innovation [RTI2018-096216-A-I00, RTI2018-093547-B-I00]; Italian Ministry of Health; National Institute On Aging of the National Institutes of Health [R01AG075775, 2P01AG019724]; ANID (FONDECYT) [1210176, 1210195]; DICYT-USACH [032351MA]; Agencia I+d+I [01-PICTE-2022-05-00103]; Multi-partner Consortium to Expand Dementia Research in Latin America (ReDLat); Fogarty International Center; National Institutes of Health; National Institute on Aging [R01AG075775, R01AG057234, R01AG21051]; Alzheimer's Association [SG-20-725707]; Rainwater Charitable Foundation's Tau Consortium; Bluefield Project to Cure Frontotemporal Dementia; Global Brain Health Institute; Marie Curie Actions (MSCA) [101025814] Funding Source: Marie Curie Actions (MSCA)","European Union(European Union (EU)); Basque Government(Basque Government); Spanish State Research Agency through BCBL Severo Ochoa excellence accreditation(Spanish Government); Ikerbasque Foundation; Spanish Ministry of Science and Innovation(Ministry of Science and Innovation, Spain (MICINN)Spanish Government); Italian Ministry of Health(Ministry of Health, Italy); National Institute On Aging of the National Institutes of Health(United States Department of Health & Human ServicesNational Institutes of Health (NIH) - USANIH National Institute on Aging (NIA)); ANID (FONDECYT); DICYT-USACH; Agencia I+d+I; Multi-partner Consortium to Expand Dementia Research in Latin America (ReDLat); Fogarty International Center(United States Department of Health & Human ServicesNational Institutes of Health (NIH) - USANIH Fogarty International Center (FIC)); National Institutes of Health(United States Department of Health & Human ServicesNational Institutes of Health (NIH) - USA); National Institute on Aging(United States Department of Health & Human ServicesNational Institutes of Health (NIH) - USANIH National Institute on Aging (NIA)); Alzheimer's Association(Alzheimer's Association); Rainwater Charitable Foundation's Tau Consortium; Bluefield Project to Cure Frontotemporal Dementia; Global Brain Health Institute; Marie Curie Actions (MSCA)(Marie Curie Actions)","This project received funding from the European Union's Horizon2020 research and innovation programme under the Marie Sklodowska-Curie grant agreement No 101025814. This research was supported by the Basque Government through the BERC2022-2025 program and by the Spanish State Research Agency through BCBL Severo Ochoa excellence accreditation CEX2020-001010-S, by the Ikerbasque Foundation and by the Plan Nacional RTI2018-096216-A-I00 (MEGLIOMA) to LA and RTI2018-093547-B-I00 (LangConn) to MC and IQ, both funded by the Spanish Ministry of Science and Innovation. This study was also supported by grants from the Italian Ministry of Health (Ricerca Corrente2023, Scientific Institute, IRCCS E. Medea) to A.F. Adolfo Garciais an Atlantic Fellow at the Global Brain Health Institute (GBHI)and is partially supported by the National Institute On Aging of the National Institutes of Health (R01AG075775, 2P01AG019724); ANID (FONDECYT Regular 1210176, 1210195); DICYT-USACH(032351MA); Agencia I+d+I (01-PICTE-2022-05-00103); and the Multi-partner Consortium to Expand Dementia Research in Latin America (ReDLat), which is supported by the Fogarty International Center and the National Institutes of Health, the National Institute on Aging (R01AG057234, R01AG075775, R01AG21051, and CARDS-NIH), Alzheimer's Association (SG-20-725707), Rainwater Charitable Foundation's Tau Consortium, the Bluefield Project to Cure Frontotemporal Dementia, and the Global Brain Health Institute. The contents of this publication are solely the responsibility of the authors and do not represent the official views of these institutions.",,94,0,0,11,11,OXFORD UNIV PRESS INC,CARY,"JOURNALS DEPT, 2001 EVANS RD, CARY, NC 27513 USA",1047-3211,1460-2199,,CEREB CORTEX,Cereb. Cortex,2-May,2024,34,5,,,,,,,bhae188,10.1093/cercor/bhae188,http://dx.doi.org/10.1093/cercor/bhae188,,,11,Neurosciences,Science Citation Index Expanded (SCI-EXPANDED),Neurosciences & Neurology,QR3A6,38741267,,,,11/13/2024,WOS:001222546200008,View Full Record in Web of Science
J,"Yoon, HJ",,,,"Yoon, Hyung-Jo",,,"Challenging the connection between task perceptions and language use in L2 writing: Genre, cognitive task complexity, and linguistic complexity",JOURNAL OF SECOND LANGUAGE WRITING,,,English,Article,,,,,,Cognitive task complexity; Genre; Second language writing; Linguistic complexity; Written production; Syntactic complexity,SYNTACTIC COMPLEXITY; GRAMMATICAL COMPLEXITY; LEXICAL COMPLEXITY; FLUENCY; ACCURACY; INDEXES,"This study explores two writing task variables (genre and idea support) that have been extensively employed in L2 writing research. It specifically examines L2 learners' perceptions and production of the narrative and argumentative tasks within which the condition of idea support is manipulated. Seventy-six ESL learners participated in this study (each wrote four essays), and they completed a self-rating task questionnaire immediately after each writing performance. Their essays were analyzed using 12 syntactic and lexical complexity measures. Results showed that the learners perceived the two genres as inducing similar cognitive demands, while judging the writing tasks with idea support as less cognitively demanding. In contrast, the learners' use of syntactic structures differed widely across the two genres, but not across the idea support conditions. These findings suggest that there may be a weak connection between cognitive task complexity and linguistic complexity in written discourse and that syntactic features in learner essays are linguistic means to express genre-specific communicative functions. This study offers implications for L2 writing research and pedagogy.","[Yoon, Hyung-Jo] Calif State Univ Northridge, Northridge, CA 91330 USA",California State University System; California State University Northridge,"Yoon, HJ (corresponding author), Calif State Univ Northridge, Northridge, CA 91330 USA.",hyungjo.yoon@csun.edu,,"Yoon, Hyung-Jo/0000-0002-8553-3708",International Research Foundation (TIRF Doctoral Dissertation Grant); National Federation of Modern Language Teachers Association (NFMLTA/MLJ Dissertation Support Grant),International Research Foundation (TIRF Doctoral Dissertation Grant); National Federation of Modern Language Teachers Association (NFMLTA/MLJ Dissertation Support Grant),"I would like to acknowledge that the funding for this research has been provided by the International Research Foundation (TIRF Doctoral Dissertation Grant, 2016) and the National Federation of Modern Language Teachers Association (NFMLTA/MLJ Dissertation Support Grant, 2016)",,52,19,20,13,82,PERGAMON-ELSEVIER SCIENCE LTD,OXFORD,"THE BOULEVARD, LANGFORD LANE, KIDLINGTON, OXFORD OX5 1GB, ENGLAND",1060-3743,1873-1422,,J SECOND LANG WRIT,J. Second. Lang. Writ.,DEC,2021,54,,,,,,,,100857,10.1016/j.jslw.2021.100857,http://dx.doi.org/10.1016/j.jslw.2021.100857,,21-Dec,14,Linguistics,Social Science Citation Index (SSCI),Linguistics,XQ1UK,,,,,11/13/2024,WOS:000731337700003,View Full Record in Web of Science
