Publication Type,Authors,Book Authors,Book Editors,Book Group Authors,Author Full Names,Book Author Full Names,Group Authors,Article Title,Source Title,Book Series Title,Book Series Subtitle,Language,Document Type,Conference Title,Conference Date,Conference Location,Conference Sponsor,Conference Host,Author Keywords,Keywords Plus,Abstract,Addresses,Affiliations,Reprint Addresses,Email Addresses,Researcher Ids,ORCIDs,Funding Orgs,Funding Name Preferred,Funding Text,Cited References,Cited Reference Count,"Times Cited, WoS Core","Times Cited, All Databases",180 Day Usage Count,Since 2013 Usage Count,Publisher,Publisher City,Publisher Address,ISSN,eISSN,ISBN,Journal Abbreviation,Journal ISO Abbreviation,Publication Date,Publication Year,Volume,Issue,Part Number,Supplement,Special Issue,Meeting Abstract,Start Page,End Page,Article Number,DOI,DOI Link,Book DOI,Early Access Date,Number of Pages,WoS Categories,Web of Science Index,Research Areas,IDS Number,Pubmed Id,Open Access Designations,Highly Cited Status,Hot Paper Status,Date of Export,UT (Unique WOS ID),Web of Science Record
J,"Ma, XY; Monfared, R; Grant, R; Goh, YM",,,,"Ma, Xinyue; Monfared, Radmehr; Grant, Rebecca; Goh, Yee Mey",,,Determining Cognitive Workload Using Physiological Measurements: Pupillometry and Heart-Rate Variability,SENSORS,,,English,Article,,,,,,cognitive workload; task performance; pupillometry; heart-rate variability; cognitive-workload index,STRESS,"The adoption of Industry 4.0 technologies in manufacturing systems has accelerated in recent years, with a shift towards understanding operators' well-being and resilience within the context of creating a human-centric manufacturing environment. In addition to measuring physical workload, monitoring operators' cognitive workload is becoming a key element in maintaining a healthy and high-performing working environment in future digitalized manufacturing systems. The current approaches to the measurement of cognitive workload may be inadequate when human operators are faced with a series of new digitalized technologies, where their impact on operators' mental workload and performance needs to be better understood. Therefore, a new method for measuring and determining the cognitive workload is required. Here, we propose a new method for determining cognitive-workload indices in a human-centric environment. The approach provides a method to define and verify the relationships between the factors of task complexity, cognitive workload, operators' level of expertise, and indirectly, the operator performance level in a highly digitalized manufacturing environment. Our strategy is tested in a series of experiments where operators perform assembly tasks on a Wankel Engine block. The physiological signals from heart-rate variability and pupillometry bio-markers of 17 operators were captured and analysed using eye-tracking and electrocardiogram sensors. The experimental results demonstrate statistically significant differences in both cardiac and pupillometry-based cognitive load indices across the four task complexity levels (rest, low, medium, and high). Notably, these developed indices also provide better indications of cognitive load responding to changes in complexity compared to other measures. Additionally, while experts appear to exhibit lower cognitive loads across all complexity levels, further analysis is required to confirm statistically significant differences. In conclusion, the results from both measurement sensors are found to be compatible and in support of the proposed new approach. Our strategy should be useful for designing and optimizing workplace environments based on the cognitive load experienced by operators.","[Ma, Xinyue; Monfared, Radmehr; Grant, Rebecca; Goh, Yee Mey] Loughborough Univ, Sch Mech Elect & Mfg Engn, Loughborough LE11 3TU, England",Loughborough University,"Goh, YM (corresponding author), Loughborough Univ, Sch Mech Elect & Mfg Engn, Loughborough LE11 3TU, England.",r.p.monfared@lboro.ac.uk; y.goh@lboro.ac.uk,"Ma, Xinyue/K-8161-2012; Monfared, Radmehr/E-5245-2010; Goh, Yee Mey/B-3157-2011","Monfared, Radmehr/0000-0002-8782-3426; Goh, Yee Mey/0000-0002-5028-9506; Grant, Rebecca/0000-0001-9804-9934",Loughborough University; Centre for Mathematical Cognition at Loughborough University,Loughborough University; Centre for Mathematical Cognition at Loughborough University,"The authors gratefully acknowledge the equipment and tutorial support from the Centre for Mathematical Cognition at Loughborough University. In particular, they would like to thank Aatif Patel for his contributions during the early stages of the research.",,47,2,2,9,10,MDPI,BASEL,"ST ALBAN-ANLAGE 66, CH-4052 BASEL, SWITZERLAND",,1424-8220,,SENSORS-BASEL,Sensors,MAR,2024,24,6,,,,,,,2010,10.3390/s24062010,http://dx.doi.org/10.3390/s24062010,,,23,"Chemistry, Analytical; Engineering, Electrical & Electronic; Instruments & Instrumentation",Science Citation Index Expanded (SCI-EXPANDED),Chemistry; Engineering; Instruments & Instrumentation,MI0Z6,38544272,"Green Published, gold",,,11/13/2024,WOS:001192889700001,View Full Record in Web of Science
C,"Wolfartsberger, J; Riedl, R",,"Davis, FD; Riedl, R; VomBrocke, J; Leger, PM; Randolph, AB; Muller-Putz, GR",,"Wolfartsberger, Josef; Riedl, Rene",,,Smart Production and Manufacturing: A Research Field with High Potential for the Application of Neurophysiological Tools,"INFORMATION SYSTEMS AND NEUROSCIENCE, NEUROIS RETREAT 2022",Lecture Notes in Information Systems and Organization,,English,Proceedings Paper,14th Annual NeuroIS Retreat Conference,"JUN 14-16, 2022","Vienna, AUSTRIA",,,Cognitive workload; Industry 4.0; Mental fatigue; Neuroscience; Smart manufacturing; Smart production; Stress,VIRTUAL-REALITY; TECHNOSTRESS; BREAKDOWN,"The concepts of Smart Production and Industry 4.0 refer to the connection of physical production with digital technology and advanced analytics to create a more holistic and flexible ecosystem. The human worker is a central element, who is mentally supported in her daily routine and decision-making processes by data-based assistive systems. Currently, there are few studies that scientifically demonstrate the effectiveness of these systems. While behavioral methods and self-report instruments are commonly used to assess cognitive workload, mental fatigue, and stress, among other variables, neurophysiological tools provide promising complementary insights. This work outlines four important application areas for the use of neurophysiology in smart production and manufacturing. The current work has the goal to instigate further research in the study domain, both theoretical and empirical.","[Wolfartsberger, Josef; Riedl, Rene] Univ Appl Sci Upper Austria, Steyr, Austria; [Riedl, Rene] Johannes Kepler Univ Linz, Linz, Austria",Johannes Kepler University Linz,"Wolfartsberger, J (corresponding author), Univ Appl Sci Upper Austria, Steyr, Austria.",josef.wolfartsberger@fh-ooe.at; rene.riedl@fh-ooe.at,,,,,,,34,0,0,0,8,SPRINGER INTERNATIONAL PUBLISHING AG,CHAM,"GEWERBESTRASSE 11, CHAM, CH-6330, SWITZERLAND",2195-4968,2195-4976,978-3-031-13063-2; 978-3-031-13064-9,L N INF SYST ORGAN,,,2022,58,,,,,,211,218,,10.1007/978-3-031-13064-9_22,http://dx.doi.org/10.1007/978-3-031-13064-9_22,,,8,"Psychology, Biological; Behavioral Sciences; Computer Science, Information Systems; Neurosciences",Conference Proceedings Citation Index - Science (CPCI-S); Conference Proceedings Citation Index - Social Science & Humanities (CPCI-SSH),Psychology; Behavioral Sciences; Computer Science; Neurosciences & Neurology,BV0VF,,,,,11/13/2024,WOS:000980192000022,View Full Record in Web of Science
C,"Bousdekis, A; Mentzas, G; Apostolou, D; Wellsandt, S",,"Kim, DY; VonCieminski, G; Romero, D",,"Bousdekis, Alexandros; Mentzas, Gregoris; Apostolou, Dimitris; Wellsandt, Stefan",,,Evaluation of AI-Based Digital Assistants in Smart Manufacturing,"ADVANCES IN PRODUCTION MANAGEMENT SYSTEMS: SMART MANUFACTURING AND LOGISTICS SYSTEMS: TURNING IDEAS INTO ACTION, APMS 2022, PT II",IFIP Advances in Information and Communication Technology,,English,Proceedings Paper,IFIP WG 5.7 International Conference on Advances in Production Management Systems (APMS) - Smart Manufacturing and Logistics Systems - Turning Ideas into Action,"SEP 25-29, 2022","Gyeongju, SOUTH KOREA",,,Industry 5.0; Evaluation methodology; Trustworthy AI; Voice-enabled assistant,MENTAL WORKLOAD; COGNITIVE LOAD; NASA-TLX,"Industry 5.0 complements the Industry 4.0 paradigm by highlighting research and innovation as drivers for a transition to a sustainable, human-centric and resilient industry. In this context, new types of interactions between operators and machines are facilitated, that can be realized through artificial intelligence (AI) based and voice-enabled Digital Intelligent Assistants (DIA). Apart from the existing technological challenges, this direction requires new methodologies for the evaluation of such technological solutions that will be able to treat AI in manufacturing as a socio-technical system. In this paper, we propose a framework for the evaluation of voice-enabled AI solutions in Industry 5.0, which consists of four dimensions: the trustworthiness of the AI system; the usability of the DIA; the cognitive workload of individual users; and the overall business benefits for the corporation.","[Bousdekis, Alexandros; Mentzas, Gregoris; Apostolou, Dimitris] Natl Tech Univ Athens NTUA, Inst Commun & Comp Syst ICCS, Informat Management Unit IMU, Athens, Greece; [Apostolou, Dimitris] Univ Piraeus, Dept Informat, Piraeus, Greece; [Wellsandt, Stefan] Univ Bremen, BIBA Bremer Inst Prod & Logist GmbH, Bremen, Germany",University of Piraeus; University of Bremen; BIBA - Bremer Institut fur Produktion & Logistik,"Bousdekis, A (corresponding author), Natl Tech Univ Athens NTUA, Inst Commun & Comp Syst ICCS, Informat Management Unit IMU, Athens, Greece.",albous@mail.ntua.gr; gmentzas@mail.ntua.gr; dapost@unipi.gr; wel@biba.uni-bremen.de,"Mentzas, Grigorios/AAD-2574-2019",,European Union [957296]; H2020 - Industrial Leadership [957296] Funding Source: H2020 - Industrial Leadership,European Union(European Union (EU)); H2020 - Industrial Leadership(European Union (EU)H2020 - Industrial Leadership),This work is partly funded by the European Union's Horizon 2020 project COALA COgnitive Assisted agile manufacturing for a LAbor force supported by trustworthy Artificial Intelligence (Grant agreement No 957296). The work presented here reflects only the authors' view and the European Commission is not responsible for any use that may be made of the information it contains.,,38,6,6,8,24,SPRINGER INTERNATIONAL PUBLISHING AG,CHAM,"GEWERBESTRASSE 11, CHAM, CH-6330, SWITZERLAND",1868-4238,1868-422X,978-3-031-16411-8; 978-3-031-16410-1,IFIP ADV INF COMM TE,,,2022,664,,,,,,503,510,,10.1007/978-3-031-16411-8_58,http://dx.doi.org/10.1007/978-3-031-16411-8_58,,,8,"Green & Sustainable Science & Technology; Engineering, Industrial; Engineering, Manufacturing",Conference Proceedings Citation Index - Science (CPCI-S),Science & Technology - Other Topics; Engineering,BU0IN,,,,,11/13/2024,WOS:000869729400058,View Full Record in Web of Science
J,"Colabianchi, S; Costantino, F; Sabetta, N",,,,"Colabianchi, Silvia; Costantino, Francesco; Sabetta, Nicolo",,,Assessment of a large language model based digital intelligent assistant in assembly manufacturing,COMPUTERS IN INDUSTRY,,,English,Article,,,,,,Chatbot; Experimental design; Artificial intelligence; Natural language processing; Industry 4.0; Industry 5.0,INDUSTRY 4.0; TRAINING SYSTEM,"The use of Digital Intelligent Assistants (DIAs) in manufacturing aims to enhance performance and reduce cognitive workload. By leveraging the advanced capabilities of Large Language Models (LLMs), the research aims to understand the impact of DIAs on assembly processes, emphasizing human-centric design and operational efficiency. The study is novel in considering the three primary objectives: evaluating the technical robustness of DIAs, assessing their effect on operators' cognitive workload and user experience, and determining the overall performance improvement of the assembly process. Methodologically, the research employs a laboratory experiment, incorporating a controlled setting to meticulously assess the DIA's performance. The experiment used a between-subjects design comparing a group of participants using the DIA against a control group relying on traditional manual methods across a series of assembly tasks. Findings reveal a significant enhancement in the operators' experience, a reduction in cognitive load, and an improvement in the quality of process outputs when the DIA is employed. The article contributes to the study of the DIA's potential and AI integration in manufacturing, offering insights into the design, development, and evaluation of DIAs in industrial settings.","[Colabianchi, Silvia; Costantino, Francesco; Sabetta, Nicolo] Sapienza Univ Rome, Dept Comp Control & Management Engn Antonio Rubert, Via Ariosto 25, I-00185 Rome, Italy",Sapienza University Rome,"Sabetta, N (corresponding author), Sapienza Univ Rome, Dept Comp Control & Management Engn Antonio Rubert, Via Ariosto 25, I-00185 Rome, Italy.",silvia.colabianchi@uniroma1.it; francesco.costantino@uniroma1.it; nicolo.sabetta@uniroma1.it,,"Colabianchi, Silvia/0000-0002-1811-8619; Sabetta, Nicolo/0009-0009-0653-455X",,,,,59,0,0,13,13,ELSEVIER,AMSTERDAM,"RADARWEG 29, 1043 NX AMSTERDAM, NETHERLANDS",0166-3615,1872-6194,,COMPUT IND,Comput. Ind.,NOV,2024,162,,,,,,,,104129,10.1016/j.compind.2024.104129,http://dx.doi.org/10.1016/j.compind.2024.104129,,24-Jul,21,"Computer Science, Interdisciplinary Applications",Science Citation Index Expanded (SCI-EXPANDED),Computer Science,A9V5T,,hybrid,,,11/13/2024,WOS:001285944800001,View Full Record in Web of Science
C,"Oliveri, LM; Lo Iacono, N; Chiacchio, F; Facchini, F; Mossa, G",,,,"Oliveri, L. M.; Lo Iacono, N.; Chiacchio, F.; Facchini, F.; Mossa, G.",,,A Decision Support System tailored to the Maintenance Activities of Industry 5.0 Operators,IFAC PAPERSONLINE,,,English,Proceedings Paper,"6th IFAC Workshop on Advanced Maintenance Engineering, Services and Technology (AMEST)","JUN 12-14, 2024","Cagliari, ITALY",,,Industry 5.0; Operator 5.0; Maintenance tasks; Human well-being; Cognitive workload; Mental workload,,"Industry 5.0 addresses the human challenges of Industry 4.0 as a human-centric solution, placing the worker's well-being at the centre of the production process. If, on the one hand, the last technologies support operator 5.0 to embrace the collaborative potential of human-machine cooperation, on the other hand, the complexity, as well as the rapid evolution of new technologies, could have the potential to produce immediate stress reaction leading to reduce the workers' well-being. Recent studies have proved that the maintenance area is experiencing many innovations in terms of approaches and technologies. In this field, the rapid progress of technological equipment is leading to an increase in the human operators' mental workload. This paper presents preliminary concepts and objectives of a Decision Support System (DSS) for the Diagnosis and Evaluation of Maintenance Operations. The DSS intends to assist industrial professionals and stakeholders in maintenance tasks characterised by significant cognitive demands. Considering variables such as task complexity and the mental and physical condition of operators involved in a maintenance task, the DSS will provide real-time recommendations for selecting the most suitable operators by promoting a gradual technology introduction, increasing industrial performance, and ensuring the well-being of the workers. Copyright (c) 2024 The Authors. This is an open access article under the CC BY-NC-ND license (https://creativecommons.org/licenses/by-nc-nd/4.0/)","[Oliveri, L. M.; Lo Iacono, N.; Chiacchio, F.] Univ Catania, Catania, Italy; [Facchini, F.; Mossa, G.] Polytech Univ Bari, Bari, Italy",University of Catania; Politecnico di Bari,"Oliveri, LM (corresponding author), Univ Catania, Catania, Italy.",ludovica.oliveri@phd.unict.it; nazarenoloiacono@gmail.com; ferdinando.chiacchio@unict.it; francesco.facchini@poliba.it; giorgio.mossa@poliba.it,,,"Italian Ministry for Universities and Research MUR - European Union -NextGenerationEU, component M4C2, investment 1.1 [CUP E53D2301732 0001, CUP D53D2301836 0001]","Italian Ministry for Universities and Research MUR - European Union -NextGenerationEU, component M4C2, investment 1.1","This research work is part of the activities carried out in the context of the DESDEMONA project (DEcision Support system for the Diagnosis and Evaluation of the Maintenance OperatioNs Activities) of the Italian Ministry for Universities and Research MUR (Project PRIN - CUP E53D2301732 0001) and (Project PRIN - CUP D53D2301836 0001) funded by the European Union -NextGenerationEU, component M4C2, investment 1.1.",,23,0,0,0,0,ELSEVIER,AMSTERDAM,"RADARWEG 29, 1043 NX AMSTERDAM, NETHERLANDS",2405-8963,,,IFAC PAPERSONLINE,IFAC PAPERSONLINE,,2024,58,8,,,,,186,191,,10.1016/j.ifacol.2024.08.118,http://dx.doi.org/10.1016/j.ifacol.2024.08.118,,,6,Automation & Control Systems,Conference Proceedings Citation Index - Science (CPCI-S),Automation & Control Systems,F6H6V,,gold,,,11/13/2024,WOS:001310813900032,View Full Record in Web of Science
J,"Afzal, MA; Gu, ZY; Afzal, B; Bukhari, SU",,,,"Afzal, Muhammad Abrar; Gu, Zhenyu; Afzal, Bilal; Bukhari, Syed Umer",,,Cognitive Workload Classification in Industry 5.0 Applications: Electroencephalography-Based Bi-Directional Gated Network Approach,ELECTRONICS,,,English,Article,,,,,,cognitive workload; Industry 5.0; electroencephalogram; bi-directional gated networks; human-robot interaction; artificial intelligence,,"In the era of Industry 5.0, effectively managing cognitive workload is crucial for optimizing human performance and ensuring operational efficiency. Using an EEG-based Bi-directional Gated Network (BDGN) approach, this study tries to figure out how to classify cognitive workload in Industry 5.0 applications. The proposed approach incorporates LSTM (Long Short-Term Memory) and GRU (Gated Recurrent Unit) models in a hybrid architecture to leverage their complementary strengths. This research highlights the utilization of the developed model alongside the MQTT (Message Queuing Telemetry Transport) protocol to facilitate real-time end-to-end data transmission. The deployed AI model performs the classification of cognitive workload based on the received data. The main findings of this research reveal an impressive accuracy of 98% in cognitive workload classification, validating the efficacy of the suggested BDGN approach. This study emphasizes the significance of leveraging EEG-based approaches in Industry 5.0 applications for cognitive workload management.","[Afzal, Muhammad Abrar; Gu, Zhenyu] Shanghai Jiao Tong Univ, Sch Design, Shanghai 200240, Peoples R China; [Afzal, Bilal] Univ Elect Sci & Technol China, Sch Management & Econ, Qingshuihe Campus, Chengdu 611731, Peoples R China; [Bukhari, Syed Umer] Changchun Univ Sci & Technol, Sch Comp Sci & Technol, Changchun 130022, Peoples R China",Shanghai Jiao Tong University; University of Electronic Science & Technology of China; Changchun University of Science & Technology,"Afzal, MA; Gu, ZY (corresponding author), Shanghai Jiao Tong Univ, Sch Design, Shanghai 200240, Peoples R China.",abrar456@sjtu.edu.cn; zygu@sjtu.edu.cn; bilal.afzal@outlook.com; umershah81@hotmail.com,"Afzal, Bilal/I-3650-2019","Af, Bilal/0000-0002-7842-0692",,,,,50,2,2,2,8,MDPI,BASEL,"ST ALBAN-ANLAGE 66, CH-4052 BASEL, SWITZERLAND",,2079-9292,,ELECTRONICS-SWITZ,Electronics,OCT,2023,12,19,,,,,,,4008,10.3390/electronics12194008,http://dx.doi.org/10.3390/electronics12194008,,,20,"Computer Science, Information Systems; Engineering, Electrical & Electronic; Physics, Applied",Science Citation Index Expanded (SCI-EXPANDED),Computer Science; Engineering; Physics,U2UB6,,gold,,,11/13/2024,WOS:001083393600001,View Full Record in Web of Science
J,"Lagomarsino, M; Lorenzini, M; De Momi, E; Ajoudani, A",,,,"Lagomarsino, Marta; Lorenzini, Marta; De Momi, Elena; Ajoudani, Arash",,,An Online Framework for Cognitive Load Assessment in Industrial Tasks,ROBOTICS AND COMPUTER-INTEGRATED MANUFACTURING,,,English,Article,,,,,,Cognitive ergonomics; Cognitive manufacturing; Assembly; Attention estimation; Stress detection,MENTAL-DISORDERS; PERFORMANCE; ATTENTION; WORKLOAD,"The ongoing trend toward Industry 4.0 has revolutionised ordinary workplaces, profoundly changing the role played by humans in the production chain. Research on ergonomics in industrial settings mainly focuses on reducing the operator's physical fatigue and discomfort to improve throughput and avoid safety hazards. However, as the production complexity increases, the cognitive resources demand and mental workload could compromise the operator's performance and the efficiency of the shop floor workplace. State-of-the-art methods in cognitive science work offline and/or involve bulky equipment hardly deployable in industrial settings. This paper presents a novel method for online assessment of cognitive load in manufacturing, primarily assembly, by detecting patterns in human motion directly from the input images of a stereo camera. Head pose estimation and skeleton tracking are exploited to investigate the workers' attention and assess hyperactivity and unforeseen movements. Pilot experiments suggest that our factor assessment tool provides significant insights into workers' mental workload, even confirmed by correlations with physiological and performance measurements. According to data gathered in this study, a vision-based cognitive load assessment has the potential to be integrated into the development of mechatronic systems for improving cognitive ergonomics in manufacturing.","[Lagomarsino, Marta; Lorenzini, Marta; Ajoudani, Arash] Ist Italiano Tecnol, Human Robot Interfaces & Phys Interact Lab, Via SQuir 19d, I-16163 Genoa, Italy; [Lagomarsino, Marta; De Momi, Elena] Politecn Milan, Dept Elect Informat & Bioengn, Via GColombo 40, I-20133 Milan, Italy",Istituto Italiano di Tecnologia - IIT; Polytechnic University of Milan,"Lagomarsino, M (corresponding author), Ist Italiano Tecnol, Human Robot Interfaces & Phys Interact Lab, Via SQuir 19d, I-16163 Genoa, Italy.;Lagomarsino, M (corresponding author), Politecn Milan, Dept Elect Informat & Bioengn, Via GColombo 40, I-20133 Milan, Italy.",marta.lagomarsino@iit.it,"Lagomarsino, Marta/GLU-8977-2022; DE MOMI, ELENA/D-7375-2016","DE MOMI, ELENA/0000-0002-8819-2734; Lagomarsino, Marta/0000-0001-9121-1812",ERC-StG Ergo-Lean [850932]; European Union?s Horizon 2020 research and innovation programme SOPHIA [871237],ERC-StG Ergo-Lean(European Research Council (ERC)); European Union?s Horizon 2020 research and innovation programme SOPHIA,"Acknowledgements This work was supported in part by the ERC-StG Ergo-Lean (Grant Agreement No. 850932) , in part by the European Union?s Horizon 2020 research and innovation programme SOPHIA (Grant Agreement No. 871237) .",,51,23,23,5,61,PERGAMON-ELSEVIER SCIENCE LTD,OXFORD,"THE BOULEVARD, LANGFORD LANE, KIDLINGTON, OXFORD OX5 1GB, ENGLAND",0736-5845,1879-2537,,ROBOT CIM-INT MANUF,Robot. Comput.-Integr. Manuf.,DEC,2022,78,,,,,,,,102380,10.1016/j.rcim.2022.102380,http://dx.doi.org/10.1016/j.rcim.2022.102380,,22-May,12,"Computer Science, Interdisciplinary Applications; Engineering, Manufacturing; Robotics",Science Citation Index Expanded (SCI-EXPANDED),Computer Science; Engineering; Robotics,1X9FI,,Green Submitted,,,11/13/2024,WOS:000807754200003,View Full Record in Web of Science
