J,"Sherry, L; Mauro, R; Donnelly, O",,,,"Sherry, Lance; Mauro, Robert; Donnelly, Oleksandra",,,Alert! The Appearance of Moded Input Devices in the Modern Airliner Cockpit,IEEE TRANSACTIONS ON HUMAN-MACHINE SYSTEMS,,,English,Article,,,,,,Input devices; Automation; Accidents; Aircraft; Visualization; Engines; Trajectory; Accidents; aviation; human– computer inter-action; system complexity,,"The automation in the flight deck of a modern airliner has grown in functionality over the past several decades, improving safety and operational efficiency. As the sophistication of automation has increased, some traditional input devices in the cockpit, such as throttle levers, yokes, and switches, have unobtrusively changed the way they work. Instead of operating the same way at all times, the behavior of these input devices has become context-sensitive (i.e., moded). It is well known in human factors design that nonsalient moded input devices require increased cognitive workload and can result in a startle, surprise, and confusion. An analysis of modern airliner cockpits identified three types of moded input devices: 1) disabled, 2) alternative behavior, and 3) command override. The implications of these results on cockpit design, certification, and flight crew training are discussed.","[Sherry, Lance] George Mason Univ, Fairfax, VA 22030 USA; [Sherry, Lance; Donnelly, Oleksandra] George Mason Univ, Ctr Air Transportat Syst Res, Fairfax, VA 22030 USA; [Mauro, Robert] Decis Res, Eugene, OR 97401 USA; [Mauro, Robert] Univ Oregon, Eugene, OR 97403 USA",George Mason University; George Mason University; University of Oregon,"Sherry, L (corresponding author), George Mason Univ, Fairfax, VA 22030 USA.",lsherry@gmu.edu; mauro@decisionresearch.com; osnisare@gmu.edu,,"Sherry, Lance/0000-0003-3630-5394",George Mason internal research account,George Mason internal research account,This work was supported by a George Mason internal research account.,,17,0,0,0,6,IEEE-INST ELECTRICAL ELECTRONICS ENGINEERS INC,PISCATAWAY,"445 HOES LANE, PISCATAWAY, NJ 08855-4141 USA",2168-2291,2168-2305,,IEEE T HUM-MACH SYST,IEEE T. Hum.-Mach. Syst.,DEC,2022,52,6,,,,,1186,1195,,10.1109/THMS.2021.3137022,http://dx.doi.org/10.1109/THMS.2021.3137022,,22-Feb,10,"Computer Science, Artificial Intelligence; Computer Science, Cybernetics",Science Citation Index Expanded (SCI-EXPANDED),Computer Science,6N2CY,,,,,11/13/2024,WOS:000758734300001,View Full Record in Web of Science
C,"Thorvald, P; Lindblom, J; Andreasson, R",,"Gao, J; ElSouri, M; Keates, S",,"Thorvald, Peter; Lindblom, Jessica; Andreasson, Rebecca",,,CLAM - A Method for Cognitive Load Assessment in Manufacturing,ADVANCES IN MANUFACTURING TECHNOLOGY XXXI,Advances in Transdisciplinary Engineering,,English,Proceedings Paper,15th International Conference on Manufacturing Research / 32nd National Conference on Manufacturing Research,"SEP 05-07, 2017","Univ Greenwich, London, ENGLAND",,Univ Greenwich,cognitive load; manufacturing; assembly; method development; CLAM method,INSTRUCTIONAL-DESIGN,"The increasing complexity and demands of assembly operations in manufacturing has been shown to lead to increased cognitive load in assembly workers. Previous work has outlined the complexity of an assembly worker's situation both in terms of difficulty and speed of work and there have been a few attempts at creating frameworks and methods for understanding the key aspects of what creates increased cognitive load. This paper presents a tool for assessing cognitive load in manufacturing, primarily assembly. The paper presents the method and an accompanying tool as well as some insights derived from this method development. The intended contribution of the work is to make a difference in reducing the cognitive load of assembly workers on the shop floor, thus focusing the development on applicability and usability of the tool in practice.","[Thorvald, Peter] Univ Skovde, Sch Engn Sci, Box 408, SE-54128 Skovde, Sweden; [Lindblom, Jessica; Andreasson, Rebecca] Univ Skovde, Sch Informat, Skovde, Sweden",University of Skovde; University of Skovde,"Thorvald, P (corresponding author), Univ Skovde, Sch Engn Sci, Box 408, SE-54128 Skovde, Sweden.",peter.thorvald@his.se,"Cort, Rebecca/AAE-8618-2020; Lindblom, Jessica/GWD-0497-2022; Thorvald, Peter/C-3143-2012","Thorvald, Peter/0000-0002-8369-5471",,,,,16,6,7,0,9,IOS PRESS,AMSTERDAM,"NIEUWE HEMWEG 6B, 1013 BG AMSTERDAM, NETHERLANDS",2352-7528,,978-1-61499-792-4; 978-1-61499-791-7,ADV TRANSDISCIPL ENG,,,2017,6,,,,,,114,119,,10.3233/978-1-61499-792-4-114,http://dx.doi.org/10.3233/978-1-61499-792-4-114,,,6,"Engineering, Industrial; Engineering, Manufacturing",Conference Proceedings Citation Index - Science (CPCI-S),Engineering,BK6NP,,,,,11/13/2024,WOS:000440620700019,View Full Record in Web of Science
C,"Lv, C; Wang, HJ; Cao, DP; Zhao, YF; Sullman, M; Auger, DJ; Brighton, J; Matthias, R; Skrypchuk, L; Mouzakitis, A",,,IEEE,"Lv, Chen; Wang, Huaji; Cao, Dongpu; Zhao, Yifan; Sullman, Mark; Auger, Daniel J.; Brighton, James; Matthias, Rebecca; Skrypchuk, Lee; Mouzakitis, Alexandros",,,A Novel Control Framework of Haptic Take-Over System for Automated Vehicles,2018 IEEE INTELLIGENT VEHICLES SYMPOSIUM (IV),IEEE Intelligent Vehicles Symposium,,English,Proceedings Paper,IEEE Intelligent Vehicles Symposium (IV),"JUN 26-30, 2018","Changshu, PEOPLES R CHINA",,,,DRIVER; SUPPORT,"Autonomous driving presents an exciting new development in vehicle technology. It poses a new challenge in driver-automation collaboration particularly during handover transitions between human and machine. In order to deal with this problem, this paper proposes a novel control framework for the haptic take-over system. The high-level framework of the haptic take-over control system, which takes driver cognitive workload, neuromuscular dynamics and optimal trajectory planning into consideration, is developed. Under the proposed framework, the determination approach of the optimal input sequence is introduced. The model of the allowed driver take-over authority, which is associated with driver's cognitive workload, as well as muscle readiness during takeover, is investigated and developed. The haptic feedback torque controller is then designed so as to minimize the deviation between the allowed control authority and driver's current degree of participation. A handover process, along with the proposed take-over control method, is also simulated. The simulation results validate the feasibility and effectiveness of the proposed approach.","[Lv, Chen] Nanyang Technol Univ, Sch Mech & Aerosp Engn, Singapore 639798, Singapore; [Lv, Chen] Nanyang Technol Univ, Sch Elect & Elect Engn, Singapore 639798, Singapore; [Wang, Huaji] AVL Powertrain UK Ltd, Coventry CV4 7EZ, W Midlands, England; [Zhao, Yifan; Auger, Daniel J.; Brighton, James] Cranfield Univ, Sch Aerosp Transport & Mfg, Bedford MK43 0AL, England; [Cao, Dongpu] Univ Waterloo, Mech & Mechatron Engn, Waterloo, ON N2L 3G1, Canada; [Sullman, Mark] Middle East Tech Univ, Kapouti, Cyprus; [Matthias, Rebecca; Skrypchuk, Lee; Mouzakitis, Alexandros] Jaguar Land Rover, Coventry CV3 4LF, W Midlands, England",Nanyang Technological University; Nanyang Technological University; Cranfield University; University of Waterloo; Jaguar Land Rover,"Lv, C (corresponding author), Nanyang Technol Univ, Sch Mech & Aerosp Engn, Singapore 639798, Singapore.;Lv, C (corresponding author), Nanyang Technol Univ, Sch Elect & Elect Engn, Singapore 639798, Singapore.",henrylvchen@gmail.com; Huaji.Wang@avl.com; dongp_ca@yahoo.com; yifan.zhao@cranfield.ac.uk; msullman@metu.edu.tr; d.j.auger@cranfield.ac.uk; j.l.brighton@cranfield.ac.uk; rmatthia@jaguarlandrover.com; lskrypch@jaguarlandrover.com; amouzakl@jaguarlandrover.com,"Zhao, Yifan/ADE-5116-2022; Auger, Daniel/IQV-7547-2023; Lv, Chen/N-7055-2018","Cao, Dongpu/0000-0003-2541-5272; Zhao, Yifan/0000-0003-2383-5724; Lv, Chen/0000-0001-6897-4512; Sullman, Mark/0000-0001-7920-6818",Jaguar Land Rover; UK-EPSRC [EP/N012089/1],Jaguar Land Rover; UK-EPSRC(UK Research & Innovation (UKRI)Engineering & Physical Sciences Research Council (EPSRC)),This research was supported by Jaguar Land Rover and the UK-EPSRC grant EP/N012089/1 as part of the jointly funded Towards Autonomy: Smart and Connected Control (TASCC) Programme.,,19,13,16,0,6,IEEE,NEW YORK,"345 E 47TH ST, NEW YORK, NY 10017 USA",1931-0587,,978-1-5386-4452-2,IEEE INT VEH SYM,,,2018,,,,,,,1596,1601,,,,,,6,"Automation & Control Systems; Computer Science, Artificial Intelligence; Robotics; Transportation Science & Technology",Conference Proceedings Citation Index - Science (CPCI-S),Automation & Control Systems; Computer Science; Robotics; Transportation,BS4IK,,,,,11/13/2024,WOS:000719424500249,View Full Record in Web of Science
C,"Nassar, Y; Albeaino, G; Jeelani, I; Gheisari, M; Issa, RRA",,"Shane, JS; Madson, KM; Mo, Y; Poleacovschi, C; Sturgill, RE",,"Nassar, Yara; Albeaino, Gilles; Jeelani, Idris; Gheisari, Masoud; Issa, Raja R. A.",,,Human-Robot Collaboration Levels in Construction: Focusing on Individuals' Cognitive Workload,"CONSTRUCTION RESEARCH CONGRESS 2024: ADVANCED TECHNOLOGIES, AUTOMATION, AND COMPUTER APPLICATIONS IN CONSTRUCTION",,,English,Proceedings Paper,2nd Joint Conference of the Construction Research Congress (CRC) / Construction-Institute (CI) Summit,"MAR 20-23, 2024","Iowa State Univ, Des Moines, IA",,Iowa State Univ,,FATIGUE,"Small collaborative ground robots that are efficiently capable of accomplishing a variety of tasks have become more ubiquitous on jobsites. With the advancement in technology and automation, it is expected that close collaborations between humans and such robots will drastically increase in the future. However, there is a need to understand how humans working with robots at different interaction levels may result in different human perceptions and cognitive workloads. In this study, a between-subject experiment was created to explore humans' perception towards robots by measuring their cognitive workload at three different human-robot collaboration levels of coexistence, cooperation, and collaboration when accomplishing a real-world bricklaying construction task. Results showed that collaborating with small ground robots may lead to lower physical demand compared to cooperating or simply coexisting with it. However, mental demand, temporal demand, performance, effort, and frustration did not significantly differ between the three collaboration levels. The outcomes of this study provide a better understanding of the safest and most efficient human-robot collaboration practices on jobsites.","[Nassar, Yara; Jeelani, Idris; Gheisari, Masoud; Issa, Raja R. A.] Univ Florida, Rinker Sch Construct Management, Gainesville, FL USA; [Albeaino, Gilles] Texas A&M Univ, Dept Construct Sci, College Stn, TX 77843 USA",State University System of Florida; University of Florida; Texas A&M University System; Texas A&M University College Station,"Albeaino, G (corresponding author), Texas A&M Univ, Dept Construct Sci, College Stn, TX 77843 USA.",yaranassar@ufl.edu; gilles.albeaino@tamu.edu; idris.jeelani@ufl.edu; masoud@ufl.edu; raymond-issa@ufl.edu,"Albeaino, Gilles/AAN-2242-2021; Jeelani, Idris/AAG-9436-2020",,,,,,27,1,1,3,4,AMER SOC CIVIL ENGINEERS,NEW YORK,"UNITED ENGINEERING CENTER, 345 E 47TH ST, NEW YORK, NY 10017-2398 USA",,,978-0-7844-8526-2,,,,2024,,,,,,,639,648,,,,,,10,Construction & Building Technology,Conference Proceedings Citation Index - Science (CPCI-S),Construction & Building Technology,BW7UR,,,,,11/13/2024,WOS:001196835000065,View Full Record in Web of Science
J,"Zheng, ZP; Yin, Z; Wang, YX; Zhang, JH",,,,"Zheng, Zhanpeng; Yin, Zhong; Wang, Yongxiong; Zhang, Jianhua",,,Inter-subject cognitive workload estimation based on a cascade ensemble of multilayer autoencoders,EXPERT SYSTEMS WITH APPLICATIONS,,,English,Article,,,,,,Cognitive workload; Stacked denoising autoencoder; Extreme learning machine; Electroencephalogram; Abstraction fusion,OPERATOR FUNCTIONAL-STATE; DAY VARIABILITY; EEG; CLASSIFICATION; MACHINE; IDENTIFICATION; RECOGNITION; AUTOMATION; REGRESSION; PERFORMANCE,"Machine learning approaches can build a computational model to predict cognitive workload levels by using electroencephalogram (EEG) feature inputs at the same time instant. However, when the EEG signals are recorded on different people, the accuracy of such a model could be impaired due to its incapability of fitting varied statistical distributions across different individuals. To this end, we propose an individual-independent workload estimator, a cascade ensemble of multilayer autoencoders to tackle the individual difference within the EEG features. It could assess the workload levels of an unseen subject by adapting the EEG data recorded from non-overlapped existing subjects. We first construct a deep stacked denoising autoencoder to abstract EEG features from a specific individual. Its shallow weights are optimized with individual-specific geometrical information of the features. Then, to find generalizable feature properties, we introduce Q-statistics to measure the independence between base learners. Finally, a regularized extreme learning machine is used as a cascade metaclassifier to fuse and filter high-level EEG abstractions and determine workload levels. We employ databases from two different experiments to validate our approach. The proposed framework can lead to acceptable accuracy and computational complexity compared to several existing workload classifiers.","[Zheng, Zhanpeng; Yin, Zhong; Wang, Yongxiong] Univ Shanghai Sci & Technol, Engn Res Ctr Opt Instrument & Syst, Shanghai Key Lab Modern Opt Syst, Minist Educ, Jungong Rd 516, Shanghai 200093, Peoples R China; [Zhang, Jianhua] Univ Shanghai Sci & Technol, Sch Opt Elect & Comp Engn, Jungong Rd 516, Shanghai 200093, Peoples R China; [Zhang, Jianhua] Oslo Metropolitan Univ, Dept Comp Sci, OsloMet Artificial Intelligence Lab, N-0130 Oslo, Norway",University of Shanghai for Science & Technology; University of Shanghai for Science & Technology; Oslo Metropolitan University (OsloMet),"Yin, Z (corresponding author), Univ Shanghai Sci & Technol, Engn Res Ctr Opt Instrument & Syst, Shanghai Key Lab Modern Opt Syst, Minist Educ, Jungong Rd 516, Shanghai 200093, Peoples R China.",182560473@st.usst.edu.cn; wyxiong@usst.edu.cn; jianhuaz@oslomet.no,,"Zheng, Zhanpeng/0000-0002-4168-3106",National Natural Science Foundation of China; Shanghai Sailing Program; National Nat- ural Science Foundation of China; [61703277]; [17YF1427000]; [61673276],National Natural Science Foundation of China(National Natural Science Foundation of China (NSFC)); Shanghai Sailing Program; National Nat- ural Science Foundation of China(National Natural Science Foundation of China (NSFC)); ; ;,This work is sponsored by the National Natural Science Foundation of China under Grant No. 61703277 and the Shanghai Sailing Program (17YF1427000) . This work is partially supported by the National Nat- ural Science Foundation of China under Grant No. 61673276.,,63,7,7,1,30,PERGAMON-ELSEVIER SCIENCE LTD,OXFORD,"THE BOULEVARD, LANGFORD LANE, KIDLINGTON, OXFORD OX5 1GB, ENGLAND",0957-4174,1873-6793,,EXPERT SYST APPL,Expert Syst. Appl.,JAN,2023,211,,,,,,,,118694,10.1016/j.eswa.2022.118694,http://dx.doi.org/10.1016/j.eswa.2022.118694,,22-Sep,19,"Computer Science, Artificial Intelligence; Engineering, Electrical & Electronic; Operations Research & Management Science",Science Citation Index Expanded (SCI-EXPANDED),Computer Science; Engineering; Operations Research & Management Science,5M1TU,,,,,11/13/2024,WOS:000870887600006,View Full Record in Web of Science
J,"Baird, I; Fendley, ME; Warren, R",,,,"Baird, Isabelle; Fendley, Mary E.; Warren, Rik",,,The Human-Automation Behavioral Interaction Task (HABIT) analysis framework,HUMAN FACTORS AND ERGONOMICS IN MANUFACTURING & SERVICE INDUSTRIES,,,English,Article,,,,,,automation; human factors methods; human-in-the-loop; human-machine interaction; task analysis,HUMAN-PERFORMANCE CONSEQUENCES; SITUATION AWARENESS; WORKLOAD; TRUST; COMPLACENCY; SKILLS; LEVEL; MODEL,"Human-machine automation systems involve integration among automated agents and goal-oriented human operators. Automation fundamentally changes the nature of the cognitive demands placed on the human operator, while simultaneously increasing the potential for out-of-the-loop performance problems to impact system efficacy. As a novel human factors method for assessing these human-automation interaction-derived, out-of-the-loop, performance challenges, we introduce the Human-Automation Behavioral Interaction Task (HABIT) analysis. The HABIT framework considers the drivers of system performance in terms of both cognitive activity and human behavior. As an example, we apply HABIT to a tedious intelligence, surveillance, and reconnaissance task. HABIT demonstrates its effectiveness in guiding the modeling and annotation of cognitive activities and successfully predicting actions resulting in errors. System designers can apply HABIT to assess human-automation interaction before a system is fielded to proactively address and mitigate out-of-the-loop performance problems.","[Baird, Isabelle; Fendley, Mary E.] Wright State Univ, Dept Ind & Human Factors Engn, Ruston, LA USA; [Warren, Rik] Wright Patterson Air Force Res Lab, Wright Patterson AFB, OH USA",,"Fendley, ME (corresponding author), Louisiana Tech Univ, Ind Engn, 600 Dan Reneau Dr, Ruston, LA 71272 USA.",mfendley@latech.edu,"Fendley, Mary/JDD-1774-2023",,Air Force Research Laboratory/Defense Associated Student Innovators Award,Air Force Research Laboratory/Defense Associated Student Innovators Award,Air Force Research Laboratory/Defense Associated Student Innovators Award,,54,1,1,6,36,WILEY,HOBOKEN,"111 RIVER ST, HOBOKEN 07030-5774, NJ USA",1090-8471,1520-6564,,HUM FACTOR ERGON MAN,Hum. Factors Ergonom. Manuf. Serv. Ind.,NOV,2022,32,6,,,,,452,461,,10.1002/hfm.20963,http://dx.doi.org/10.1002/hfm.20963,,22-Jun,10,"Engineering, Manufacturing; Ergonomics",Science Citation Index Expanded (SCI-EXPANDED); Social Science Citation Index (SSCI),Engineering,5C9XD,,,,,11/13/2024,WOS:000811164100001,View Full Record in Web of Science
J,"Ahmadnezhad, P; Burns, JM; Akinwuntan, AE; Ranchet, M; Kondyli, A; Mahnken, JD; Devos, H",,,,"Ahmadnezhad, Pedram M.; Burns, Jeffrey E.; Akinwuntan, Abiodun; Ranchet, Maud; Kondyli, Alexandra D.; Mahnken, Jonathan; Devos, Hannes",,,Driving Automation for Older Adults with Preclinical Alzheimer's Disease,GERONTOLOGY,,,English,Article,,,,,,,FLORBETAPIR F 18; PERFORMANCE; RISK; PET; INDIVIDUALS; DEFINITION; DECLINE,"Background: Older adults with preclinical Alzheimer's disease (AD) show changes in on-road driving performance. The impact of preclinical AD on using automated vehicle (AV) technology is unknown. The aim was to evaluate safety and cognitive workload while operating AV technology in drivers with preclinical AD.Methods: This cross-sectional study included 40 participants: 19 older adults (age 74.16 & PLUSMN; 4.78; MOCA scores 26.42 & PLUSMN; 2.52) with preclinical AD, evidenced by elevated cortical beta-amyloid; and 21 controls (age 73.81 & PLUSMN; 5.62; MOCA scores 28.24 & PLUSMN; 1.67). All participants completed two scenarios in a driving simulator. Scenario 1 included conditional automation with an emergency event that required a manual take-over maneuver. Scenario 2 was identical but with a cognitive distractor task. Emergency response time was the main safety outcome measure. Cognitive workload was calculated using moment-to-moment changes in pupillary size and converted into an Index of Cognitive Activity (ICA). Mann-Whitney U and independent t-tests were used to compare group differences.Results: Emergency response times were similar between drivers with preclinical AD and controls in scenario 1 (20.85s & PLUSMN; 1.08 vs 20.52s & PLUSMN; 3.18; p = 0.83) and scenario 2 (14.83s & PLUSMN; 7.37 vs 13.45s & PLUSMN; 10.43; p = 0.92). Likewise, no differences were found in ICA between drivers with preclinical AD and controls in scenario 1 (0.34 & PLUSMN; 0.08 vs 0.33 & PLUSMN; 0.17; p = 0.74) or scenario 2 (0.30 & PLUSMN; 0.07 vs 0.29 & PLUSMN; 0.17; p = 0.93). Conclusions: Older drivers with preclinical AD may safely operate AV technology, without increased response times or cognitive workload. Future on-road studies with AV technology should confirm these preliminary results in drivers with preclinical AD.","[Ahmadnezhad, Pedram M.; Akinwuntan, Abiodun; Devos, Hannes] Univ Kansas, Dept Phys Therapy Rehabil Sci & Athlet Training, Med Ctr, Kansas City, KS USA; [Burns, Jeffrey E.; Mahnken, Jonathan; Devos, Hannes] Univ Kansas, Med Ctr, Alzheimers Dis Res Ctr, Kansas City, KS USA; [Akinwuntan, Abiodun] Univ Kansas, Med Ctr, Center Community Access Rehabil Res Educ & Serv KU, Kansas City, KS USA; [Ranchet, Maud] Univ Lyon, Univ Gustave Eiffel, IFSTTAR, F-69675 Lyon, France; [Kondyli, Alexandra D.] Univ Kansas, Dept Civil Environm & Architectural Engn, Lawrence, KS USA; [Mahnken, Jonathan] Univ Kansas, Dept Biostat & Data Sci, Med Ctr, Kansas City, KS USA; [Devos, Hannes] Univ Kansas, Dept Phys Therapy Rehabil Sci & Athlet Training, Med Ctr, MS2002,3901 Rainbow Blvd, Kansas City, KS 66160 USA",University of Kansas; University of Kansas Medical Center; University of Kansas; University of Kansas Medical Center; University of Kansas; University of Kansas Medical Center; Universite Gustave-Eiffel; University of Kansas; University of Kansas; University of Kansas Medical Center; University of Kansas; University of Kansas Medical Center,"Devos, H (corresponding author), Univ Kansas, Dept Phys Therapy Rehabil Sci & Athlet Training, Med Ctr, MS2002,3901 Rainbow Blvd, Kansas City, KS 66160 USA.",hdevos@kumc.edu,"/AAF-2672-2019; Devos, Hannes/I-6852-2019; RANCHET, Maud/HPH-5368-2023","Kondyli, Alexandra/0000-0002-3462-0000; RANCHET, Maud/0000-0002-5325-064X","Forrest and Sally Hoglund; National Institutes of Health [S10 RR29577]; National Institute on Aging of the National Institutes of Health [K01 AG058785, P30 AG072973]; KU Alzheimer Disease Research Center [P30 AG035982]",Forrest and Sally Hoglund; National Institutes of Health(United States Department of Health & Human ServicesNational Institutes of Health (NIH) - USA); National Institute on Aging of the National Institutes of Health(United States Department of Health & Human ServicesNational Institutes of Health (NIH) - USANIH National Institute on Aging (NIA)); KU Alzheimer Disease Research Center,This work was completed at the Hoglund Biomedical Imaging Center which is supported by the Forrest and Sally Hoglund and a High-End Instrumentation grant from the National Institutes of Health (S10 RR29577). Research reported in this publication was supported by the National Institute on Aging of the National Institutes of Health under Award Number K01 AG058785 and P30 AG072973. This study was supported in part by a pilot grant of the KU Alzheimer Disease Research Center (P30 AG035982). The content is solely the responsibility of the authors and does not necessarily represent the official views of the National Institutes of Health.,,58,0,0,0,3,KARGER,BASEL,"ALLSCHWILERSTRASSE 10, CH-4009 BASEL, SWITZERLAND",0304-324X,1423-0003,,GERONTOLOGY,Gerontology,NOV,2023,69,11,,,,,1307,1314,,10.1159/000531263,http://dx.doi.org/10.1159/000531263,,23-Aug,8,Geriatrics & Gerontology,Science Citation Index Expanded (SCI-EXPANDED),Geriatrics & Gerontology,Y1FU1,37557082,Green Accepted,,,11/13/2024,WOS:001045055000001,View Full Record in Web of Science
