44,C,"Dewi, DS; Septiana, T",,"Pujawan, N; Ciptomulyono, U; Baihaqi, I; Santosa, B",,"Dewi, Dyah Santhi; Septiana, Tyasiliah",,,Workforce scheduling considering physical and mental workload: A case study of domestic freight forwarding,"INDUSTRIAL ENGINEERING AND SERVICE SCIENCE 2015, IESS 2015",Procedia Manufacturing,,English,Proceedings Paper,International Conference on Industrial Engineering and Service Science (IESS),"SEP 01-02, 2015","Yogyakarta, INDONESIA",,,Physical workload; mental Workload; NASA_TLX; workforce scheduling; domestic freight forwarding,,"Manufacturing industry depend heavily on logistic service provider to distribute their product. Logistic company ussualy work based on order from manufacturer. Depending on the circumtances, orders received by logistic service provider in most cases are uncertain. Fluctuations or uncertainty of order becomes a problem to many logistic companies because it affects the way they have to schedule their workers. Workforce scheduling is hence necessary for allocating appropriate worker in the right place and in the right time. Inappropriate workforce scheduling could imbalance workloads within workers which leads to worker dissatisfaction. This study therefore aims to design a workforce scheduling that consider worker workload of Domestics Freight Forwarding particularly in Company X. The research will first measure the workload, both physical and mental workload. The method used for physical workload measurement is based on calorie consumptions based on Indonesia National Standard (SNI). Whereas NASA-TLX subjective approach method is used to measure mental workload. Then, by using the result of the workload measurements, a workforce scheduling model is designed to balance the workload. Goal programing is used to model the workforce scheduling. The result of workload measurement shows that workers have low productivity but high level of mental workload, while for the physical workload there is no significant difference in each warehouse and shipping. In order to increase the utility of the workers, instead of 3 shifts it is suggested that company apply 2 shifts work systems for Checker. Also, minimizing factors that reduce the productivity such the mobility of outstation (dinas luar). (C) 2015 Published by Elsevier B.V.","[Dewi, Dyah Santhi; Septiana, Tyasiliah] Inst Technol Sepuluh Nopember, Dept Ind Engn, Surabaya 60111, Indonesia",Institut Teknologi Sepuluh Nopember,"Septiana, T (corresponding author), Inst Technol Sepuluh Nopember, Dept Ind Engn, Surabaya 60111, Indonesia.",tyasiliah@gmail.com,,,,,,,10,8,8,0,15,ELSEVIER SCIENCE BV,AMSTERDAM,"SARA BURGERHARTSTRAAT 25, PO BOX 211, 1000 AE AMSTERDAM, NETHERLANDS",2351-9789,,,PROCEDIA MANUF,,,2015,4.0,,,,,,445.0,453.0,,10.1016/j.promfg.2015.11.061,0.0,,,9,"Engineering, Industrial; Operations Research & Management Science",Conference Proceedings Citation Index - Science (CPCI-S),Engineering; Operations Research & Management Science,BF2SS,,gold,,,2024-11-14,WOS:000380496500055,0,Physical workload; mental Workload; NASA_TLX; workforce scheduling; domestic freight forwarding
45,J,"Wu, YH; Zeng, SY; Yu, Y",,,,"Wu, Yinghui; Zeng, Shaoyu; Yu, Yang",,,MODELLING AND A HYBRID GENETIC ALGORITHM FOR THE EQUITY-ORIENTED WORKER ASSIGNMENT PROBLEM IN SERU PRODUCTION SYSTEMS,JOURNAL OF INDUSTRIAL AND MANAGEMENT OPTIMIZATION,,,English,Article,,,,,,Key words and phrases; seru Production system; worker assignment; mixed integer nonlinear programming; hybrid genetic algorithm,LINE-CELL CONVERSION; CONVEYOR ASSEMBLY-LINE; OPTIMIZATION MODEL; BALANCING PROBLEM; COST,". Worker assignment is critical for developing a flexible and humancentered seru production system (SPS). Most studies in the literature focus on worker assignment with the objective of maximizing system efficiency, which causes an inescapable consequence that workers with high proficiency levels experience overwork compared with workers with lower proficiency levels. From the perspective of workload equity, we investigate the worker assignment problem in SPS, where the heterogeneity of workers with diverse skill sets and skill proficiency levels is taken into account. A mixed integer nonlinear programming model named the equity-oriented model is proposed for this problem to mitigate the workload inequity among workers by minimizing the maximum workload of workers. The equity-oriented model is linearized and solved by the CPLEX solver for small-scale instances. For efficiently solving large-scale instances, we design a hybrid genetic algorithm combined with local search. Computational experiments demonstrate the high performance of the hybrid genetic algorithm, both in terms of computing time and solution quality. We find that using the equity-oriented model can significantly balance the workload among workers at the cost of minimal increases in the total labor hours.","[Wu, Yinghui; Zeng, Shaoyu] Jiangsu Univ Sci & Technol, Sch Econ & Management, Zhenjiang 212100, Peoples R China; [Yu, Yang] Northeastern Univ, Inst Intelligent Data & Syst Engn, State Key Lab Synthet Automat Proc Ind, Shenyang 110819, Peoples R China",Jiangsu University of Science & Technology; Northeastern University - China,"Wu, YH; Zeng, SY (corresponding author), Jiangsu Univ Sci & Technol, Sch Econ & Management, Zhenjiang 212100, Peoples R China.",,,,National Natural Science Foundation of China [71571037]; National Natural Science Founda-tion of China [71571037],National Natural Science Foundation of China(National Natural Science Foundation of China (NSFC)); National Natural Science Founda-tion of China(National Natural Science Foundation of China (NSFC)),The third author is supported by [National Natural Science Foundation of China grant 71571037] .Acknowledgments. We wish to express our great appreciation to the editor and two anonymous reviewers for their valuable comments and suggestions. We grate-fully acknowledge the financial support from the National Natural Science Founda-tion of China (Grant No. 71571037) .,,65,1,1,4,28,AMER INST MATHEMATICAL SCIENCES-AIMS,SPRINGFIELD,"PO BOX 2604, SPRINGFIELD, MO 65801-2604, UNITED STATES",1547-5816,1553-166X,,J IND MANAG OPTIM,J. Ind. Manag. Optim.,JAN,2024,20.0,1,,,,,36.0,58.0,,10.3934/jimo.2023068,0.0,,JUN 2023,23,"Engineering, Multidisciplinary; Operations Research & Management Science; Mathematics, Interdisciplinary Applications",Science Citation Index Expanded (SCI-EXPANDED),Engineering; Operations Research & Management Science; Mathematics,Y0ZR9,,gold,,,2024-11-14,WOS:001009142600001,0,Key words and phrases; seru Production system; worker assignment; mixed integer nonlinear programming; hybrid genetic algorithm; LINE-CELL CONVERSION; CONVEYOR ASSEMBLY-LINE; OPTIMIZATION MODEL; BALANCING PROBLEM; COST
46,J,"Luo, Q; Deng, QW; Gong, GL; Guo, X; Liu, XH",,,,"Luo, Qiang; Deng, Qianwang; Gong, Guiliang; Guo, Xin; Liu, Xiahui",,,A distributed flexible job shop scheduling problem considering worker arrangement using an improved memetic algorithm,EXPERT SYSTEMS WITH APPLICATIONS,,,English,Article,,,,,,Distributedflexiblejobshopscheduling; Workerarrangement; Memeticalgorithm; Adaptiveneighborhoodsearch,GENETIC ALGORITHM; FLEXIBILITY; OPTIMIZATION,"The classical distributed flexible job shop scheduling problem (DFJSP) mainly considers factory allocation, machine arrangement, job sequencing and transportation. To date, the relevant literature has not studied the DFJSPs with worker arrangement, which widely exists in practical manufacturing systems. In this paper, we investigate the DFJSP with worker arrangement (DFJSPW), where not only the factories, machines and operations, but the workers are considered simultaneously. A mixed-integer linear programming model is formulated for this problem. Correspondingly, an improved memetic algorithm (IMA) based on the structure of NSGA-II is proposed for the proposed DFJSPW whose objective is to minimize the makespan, maximum workload of machines and workload of workers simultaneously. In IMA, a simplified two-level encoding and four heuristic decoding methods are designed to encode and decode the individuals. A well-designed adaptive neighborhood search operator is developed to enhance the local search ability of IMA and speed its convergence. Fifty-eight benchmarks are constructed to evaluate the performance of our proposed IMA. Extensive experiments show that in most examples, IMA performs better than four well-known multi-objective algorithms, demonstrating the superiority of IMA in solving the DFJSPW.","[Luo, Qiang; Deng, Qianwang; Gong, Guiliang; Guo, Xin; Liu, Xiahui] Hunan Univ, State Key Lab Adv Design & Mfg Vehicle Body, Changsha 410082, Peoples R China; [Gong, Guiliang] Cent South Univ Forestry & Technol, Dept Mech & Elect Engn, Changsha 410004, Peoples R China",Hunan University; Central South University of Forestry & Technology,"Deng, QW (corresponding author), Hunan Univ, State Key Lab Adv Design & Mfg Vehicle Body, Changsha 410082, Peoples R China.",qiangluo@hnu.edu.cn; deng_arbeit@hnu.edu.cn; gongguiliang@hnu.edu.cn; gotham@hnu.edu.cn; liuxiahui@hnu.edu.cn,"Luo, Qiang/IAQ-9193-2023","Luo, Qiang/0000-0002-3557-6638; deng, qianwang/0000-0003-1779-6634","National Key R&D Program of China [2020YFB1712100, 2018YFB1701400]; Foshan Techno-logical Innovation Project [1920001000041]; National Natural Sci-ence Foundation of China [72001217]; Nature Science Foundation of Hunan [2021JJ41081]; Natural Science Foundation of Changsha [kq2007033]; State Key Laboratory of Advanced Design and Manufacturing for Vehicle Body, Hunan University [71775004]; State Key Labo-ratory of Construction Machinery [SKLCM2019-03]","National Key R&D Program of China; Foshan Techno-logical Innovation Project; National Natural Sci-ence Foundation of China(National Natural Science Foundation of China (NSFC)); Nature Science Foundation of Hunan; Natural Science Foundation of Changsha; State Key Laboratory of Advanced Design and Manufacturing for Vehicle Body, Hunan University; State Key Labo-ratory of Construction Machinery","Acknowledgements This work was funded by the National Key R&D Program of China (grant number 2020YFB1712100, 2018YFB1701400) ; Foshan Techno-logical Innovation Project (1920001000041) ; the National Natural Sci-ence Foundation of China (grant number 72001217) ; the Nature Science Foundation of Hunan (grant number 2021JJ41081) ; the Natural Science Foundation of Changsha (grant number kq2007033) ; the State Key Laboratory of Advanced Design and Manufacturing for Vehicle Body, Hunan University (grant number 71775004) ; and the State Key Labo-ratory of Construction Machinery (grant number SKLCM2019-03) .",,55,33,37,25,194,PERGAMON-ELSEVIER SCIENCE LTD,OXFORD,"THE BOULEVARD, LANGFORD LANE, KIDLINGTON, OXFORD OX5 1GB, ENGLAND",0957-4174,1873-6793,,EXPERT SYST APPL,Expert Syst. Appl.,NOV 30,2022,207.0,,,,,,,,117984,10.1016/j.eswa.2022.117984,0.0,,JUL 2022,16,"Computer Science, Artificial Intelligence; Engineering, Electrical & Electronic; Operations Research & Management Science",Science Citation Index Expanded (SCI-EXPANDED),Computer Science; Engineering; Operations Research & Management Science,3B5GT,,,,,2024-11-14,WOS:000827969900008,0,Distributedflexiblejobshopscheduling; Workerarrangement; Memeticalgorithm; Adaptiveneighborhoodsearch; GENETIC ALGORITHM; FLEXIBILITY; OPTIMIZATION
47,J,"Fathi, M; Sepehri, A; Ghobakhloo, M; Iranmanesh, M; Tseng, ML",,,,"Fathi, Masood; Sepehri, Arash; Ghobakhloo, Morteza; Iranmanesh, Mohammad; Tseng, Ming-Lang",,,Balancing assembly lines with industrial and collaborative robots: Current trends and future research directions,COMPUTERS & INDUSTRIAL ENGINEERING,,,English,Article,,,,,,Assembly line balancing; Human -robot collaboration; Systematic literature review; Industrial robot; Collaborative robot,MATHEMATICAL-MODEL; ENERGY-CONSUMPTION; GENETIC ALGORITHM; CYCLE TIME; OPTIMIZATION; HEURISTICS; CARBON; METAHEURISTICS; WORKLOAD; SOLVE,"Assembly-line balancing is a significant issue in production systems. Employing industrial robots as the main production resource was a milestone in developing assembly lines, and emerging Industry 4.0 led industries to build collaborative assembly lines by combining robots and human operator skills. Recently, the majority of research on assembly line balancing has contributed to addressing aspects of utilizing robots in assembly lines and how they can increase line performance. Various models and methods are developed, considering different objectives and performance indicators. Despite the increasing number of studies in this area, a thorough literature review is lacking in identifying gaps, shedding light on research directions, and facilitating future development. This study systematically reviews assembly-line balancing studies targeted at assembly lines with industrial and collaborative robots. Studies are classified based on their objectives and reviewed for their solution method, line layout, and other essential specifications. A descriptive analysis is provided to assist researchers and practitioners in linking different properties of assembly lines to the objectives and applied methodologies. The results show that most studies developed models and solution methods that focused on simultaneously optimizing more than one objective. The review reveals that minimizing the cycle time is the most popular objective, and meta-heuristic algorithms are the dominant solution approaches. It is also observed that balancing assembly lines with collaborative robots has received more attention in the last five years with the emergence of Industry 4.0. The review also highlights gaps in the related literature and provides promising insights for future research.","[Fathi, Masood] Univ Skovde, Sch Engn Sci, Div Intelligent Prod Syst, S-54128 Skovde, Sweden; [Fathi, Masood; Ghobakhloo, Morteza] Uppsala Univ, Div Ind Engn & Management, POB 534, S-75121 Uppsala, Sweden; [Sepehri, Arash] Delft Univ Technol, Fac Civil Engn & Geosci, Dept Hydraul Engn, Delft, Netherlands; [Iranmanesh, Mohammad] La Trobe Univ, La Trobe Business Sch, Melbourne, Vic, Australia; [Tseng, Ming-Lang] Asia Univ, Inst Innovat & Circular Econ, Taichung, Taiwan; [Tseng, Ming-Lang] China Med Univ, China Med Univ Hosp, Dept Med Res, Taichung, Taiwan; [Tseng, Ming-Lang] Khon Kaen Univ, Dept Ind Engn, Khon Kaen 40002, Thailand",University of Skovde; Uppsala University; Delft University of Technology; La Trobe University; Asia University Taiwan; China Medical University Taiwan; China Medical University Hospital - Taiwan; Khon Kaen University,"Fathi, M (corresponding author), Univ Skovde, Sch Engn Sci, Div Intelligent Prod Syst, S-54128 Skovde, Sweden.",masood.fathi@his.se,"Fathi, Masood/AAW-7425-2020; Ghobakhloo, Morteza/AAF-2508-2020","Sepehri, Arash/0000-0001-6623-5265",Knowledge Foundation (KKS); Sweden's Innovation Agency via the ACCURATE 4.0 [20200181]; Swedish Heart-Lung Foundation [20200181] Funding Source: Swedish Heart-Lung Foundation,Knowledge Foundation (KKS); Sweden's Innovation Agency via the ACCURATE 4.0; Swedish Heart-Lung Foundation(Swedish Heart-Lung Foundation),"The first author, Masood Fathi, would like to acknowledge funding from the Knowledge Foundation (KKS) and Sweden's Innovation Agency via the ACCURATE 4.0 (grant agreement No. 20200181) and PREFER projects, respectively.",,117,0,0,30,30,PERGAMON-ELSEVIER SCIENCE LTD,OXFORD,"THE BOULEVARD, LANGFORD LANE, KIDLINGTON, OXFORD OX5 1GB, ENGLAND",0360-8352,1879-0550,,COMPUT IND ENG,Comput. Ind. Eng.,JUL,2024,193.0,,,,,,,,110254,10.1016/j.cie.2024.110254,0.0,,JUN 2024,23,"Computer Science, Interdisciplinary Applications; Engineering, Industrial",Science Citation Index Expanded (SCI-EXPANDED),Computer Science; Engineering,XA3Y7,,hybrid,,,2024-11-14,WOS:001258933900001,0,Assembly line balancing; Human -robot collaboration; Systematic literature review; Industrial robot; Collaborative robot; MATHEMATICAL-MODEL; ENERGY-CONSUMPTION; GENETIC ALGORITHM; CYCLE TIME; OPTIMIZATION; HEURISTICS; CARBON; METAHEURISTICS; WORKLOAD; SOLVE
48,J,"Torres, Y; Nadeau, S; Landau, K",,,,"Torres, Yaniel; Nadeau, Sylvie; Landau, Kurt",,,Evaluation of Fatigue and Workload among Workers Conducting Complex Manual Assembly in Manufacturing,IISE TRANSACTIONS ON OCCUPATIONAL ERGONOMICS & HUMAN FACTORS,,,English,Article,,,,,,Production demand; shift work; sleep; mental demand; subjective metrics,NASA-TLX; HUMAN-PERFORMANCE; MENTAL WORKLOAD; SLEEP; QUALITY; ERGONOMICS; TASK; INSTRUCTIONS; PRINCIPLES; HEALTH,"OCCUPATIONAL APPLICATIONS We conducted a study to evaluate fatigue and workload among workers performing complex assembly tasks. We investigate several predictors of fatigue, including subjective workload estimates, sleep duration, the shift being worked, and production levels. High levels of fatigue were reported in one-third of the shifts evaluated. The main predictors of high fatigue were workload estimates, working evening shifts, and baseline fatigue. Among the six dimensions of workload, only mental demand and frustration were predictors of high fatigue. Mental demand was also rated highest. Participants reported less than seven hours of sleep in 60% of the nights evaluated. These results suggest that managers and supervisors should consider cognitive workload as a key contributing factor to fatigue in complex manual assembly. Similarly, work schedule planning should consider shift duration, start times, and end times, because of the negative influence on fatigue and the potential disruptions on sleep among workers. TECHNICAL ABSTRACT Background: General fatigue and mental workload have been studied extensively in safety-critical contexts; wherein human performance degradation can lead to catastrophic outcomes. In the manufacturing sector, the physical demands of a job have received most of the attention because of the presence of biomechanical loads and the incidence of musculoskeletal disorders. However, in complex manual assembly, cognitive and chronobiology aspects of work can contribute to fatigue and degrade worker performance. Purpose: We aimed to evaluate self-reported levels of fatigue and workload among a group of workers performing complex assembly tasks. We also sought to investigate several predictors of fatigue, including workload estimates, sleep duration, the shift being worked, and production levels. Methods: Fourteen assembly line workers participated in a two-week study. They evaluated their levels of fatigue at the beginning and end of each shift using the Samn-Perelli Fatigue Scale. They also evaluated their workload according to the NASA-TLX scale at the end of each shift. Results: High levels of fatigue (fatigue score >= 5) were reported in approximately one-third of 114 work shifts evaluated. Binary logistic regression indicated that fatigue scores at the beginning of the shift, NASA-TLX scores, and working evening shifts were significant predictors of high levels of fatigue. Among the six dimensions measured by NASA-TLX, only mental demand and frustration were predictors of high fatigue. Mental demand was also rated highest by the workers. Participants reported less than seven hours of sleep in 60% of the nights evaluated. Conclusions: These results suggest that cognitive load can contribute to fatigue in complex manual assembly work. Circadian and homeostatic processes related to shift duration, start times, and end times are also potential contributing factors. Similarly, existing work schedules may be contributing to sleep disruptions among workers.","[Torres, Yaniel; Nadeau, Sylvie; Landau, Kurt] Ecole Technol Super, Dept Mech Engn, Montreal, PQ, Canada; [Landau, Kurt] Tech Univ Darmstadt, Inst Ergon & Human Factors, Darmstadt, Germany",University of Quebec; Ecole de Technologie Superieure - Canada; Technical University of Darmstadt,"Torres, Y (corresponding author), Ecole Technol Super, Dept Mech Engn, Montreal, PQ, Canada.",yaniel.torres-medina.1@ens.etsmtl.ca,"Torres, Yaniel/IWD-8411-2023","Torres, Yaniel/0000-0002-9825-9437",MITACS [IT12360]; Natural Sciences and Engineering Research Council of Canada (NSERC),MITACS; Natural Sciences and Engineering Research Council of Canada (NSERC)(Natural Sciences and Engineering Research Council of Canada (NSERC)),"This research was funded by MITACS, grant number IT12360 and the Natural Sciences and Engineering Research Council of Canada (NSERC).",,92,8,8,3,24,TAYLOR & FRANCIS INC,PHILADELPHIA,"530 WALNUT STREET, STE 850, PHILADELPHIA, PA 19106 USA",2472-5838,2472-5846,,IISE T OCCUP ERG HUM,IISE Trans. Occup. Ergon. Hum. Factors,JAN 2,2021,9.0,1,,,,,49.0,63.0,,10.1080/24725838.2021.1997835,0.0,,OCT 2021,15,Ergonomics,Emerging Sources Citation Index (ESCI),Engineering,XC4XK,34706621.0,,,,2024-11-14,WOS:000718229200001,0,Production demand; shift work; sleep; mental demand; subjective metrics; NASA-TLX; HUMAN-PERFORMANCE; MENTAL WORKLOAD; SLEEP; QUALITY; ERGONOMICS; TASK; INSTRUCTIONS; PRINCIPLES; HEALTH
49,J,"Tapkan, P; zbakir, L; Baykasoglu, A",,,,"Tapkan, Pinar; Ozbakir, Lale; Baykasoglu, Adil",,,Bee algorithms for parallel two-sided assembly line balancing problem with walking times,APPLIED SOFT COMPUTING,,,English,Article,,,,,,Parallel two-sided assembly line balancing problem; Walking times; Bees algorithm; Artificial bee colony algorithm; Mathematical programming model,TABU SEARCH ALGORITHM; GENETIC ALGORITHM; COLONY ALGORITHM; MODEL; OPTIMIZATION,"Production lines, designed in a serial manner, have attracted the attention of researchers for many years. Line efficiency, throughput time and workload balancing are the main concerns regarding assembly lines, due to the high volume production. Recently, specific assembly line configurations, such as two-sided and parallel lines, have been addressed by researchers within the operational levels of production. Parallel two-sided assembly lines, rather a new research area, allocate more flexible workers and reduce throughput time by incorporating the advantages of two-sided and parallel assembly lines. Since parallel two-sided assembly lines are utilized to produce large-scale products, such as automobiles, trucks, and buses in industry; they also require a significant worker movement between parallel lines because of the unavoidable walking distances between lines. In this respect, different from the existing literature, walking distances have been included in parallel two-sided assembly line balancing problem. The main purpose of this paper is to introduce parallel two-sided assembly line balancing problem with walking times and to propose the implementation of Bees Algorithm and Artificial Bee Colony algorithm due to the NP-hardness of the problem. An extensive computational study is also carried out and the comparative results are presented. (C) 2015 Elsevier B.V. All rights reserved.","[Tapkan, Pinar; Ozbakir, Lale] Erciyes Univ, Dept Ind Engn, Kayseri, Turkey; [Baykasoglu, Adil] Dokuz Eylul Univ, Dept Ind Engn, Izmir, Turkey",Erciyes University; Dokuz Eylul University,"Tapkan, P (corresponding author), Erciyes Univ, Dept Ind Engn, Kayseri, Turkey.",pinartan@erciyes.edu.tr; lozbakir@erciyes.edu.tr; adil.baykasoglu@deu.edu.tr,"tapkan, pnar/AAV-5711-2020; zbakr, Lale/L-2406-2018; Baykasoglu, Adil/G-4311-2010","Baykasoglu, Adil/0000-0002-4952-7239; Ozbakir, Lale/0000-0002-8103-7715",,,,,53,45,48,3,70,ELSEVIER,AMSTERDAM,"RADARWEG 29, 1043 NX AMSTERDAM, NETHERLANDS",1568-4946,1872-9681,,APPL SOFT COMPUT,Appl. Soft. Comput.,FEB,2016,39.0,,,,,,275.0,291.0,,10.1016/j.asoc.2015.11.017,0.0,,,17,"Computer Science, Artificial Intelligence; Computer Science, Interdisciplinary Applications",Science Citation Index Expanded (SCI-EXPANDED),Computer Science,DA3TM,,,,,2024-11-14,WOS:000367721800016,0,Parallel two-sided assembly line balancing problem; Walking times; Bees algorithm; Artificial bee colony algorithm; Mathematical programming model; TABU SEARCH ALGORITHM; GENETIC ALGORITHM; COLONY ALGORITHM; MODEL; OPTIMIZATION
