144,J,"Wang, P; Wang, Y; Billinghurst, M; Yang, HZ; Xu, P; Li, YH",,,,"Wang, Peng; Wang, Yue; Billinghurst, Mark; Yang, Huizhen; Xu, Peng; Li, Yanhong",,,BeHere: a VR/SAR remote collaboration system based on virtual replicas sharing gesture and avatar in a procedural task,VIRTUAL REALITY,,,English,Article,,,,,,Virtual reality; Spatial augmented reality; Virtual replicas or avatar; Remote collaboration; Hand gesture; Human-computer interaction,REALITY,"In this paper, we focus on the significance of remote collaboration using virtual replicas, avatar, and gesture on a procedural task in industry; thus, we present a Virtual Reality (VR)/Spatial Augmented Reality (SAR) remote collaboration system, BeHere, based on 3D virtual replicas and sharing gestures and avatar. BeHere enables a remote expert in VR to guide a local worker in real-time to complete a procedural task in the real-world. For the remote VR site, we construct a 3D virtual environment using virtual replicas, and the user can manipulate them by using gestures in an intuitive interaction and see their partners' 3D virtual avatar. For the local site, we use SAR to enable the local worker to see instructions projected onto the real-world based on the shared virtual replicas and gestures. We conducted a formal user study to evaluate the prototype system in terms of performance, social presence, workload, and ranking and user preference. We found that the combination of visual cues of gestures, avatar, and virtual replicas plays a positive role in improving user experience, especially for remote VR users. More significantly, our study provides useful information and important design implications for further research on the use of gesture-, gaze- and avatar-based cues as well as virtual replicas in VR/AR remote collaboration on a procedural task in industry.","[Wang, Peng; Wang, Yue] Chongqing Univ Posts & Telecommun, Sch Adv Mfg Engn, Chongqing 400065, Peoples R China; [Billinghurst, Mark] Univ Auckland, Auckland Bioengn Inst, Auckland, New Zealand; [Yang, Huizhen] Beijing Inst Technol, Chongqing Innovat Ctr, Beijing, Peoples R China; [Xu, Peng] Jiangsu JARI Technol Grp Co Ltd, Res Inst CSIC 716, Lianyungang, Jiang Su, Peoples R China; [Li, Yanhong] Jiuquan Iron & Steel Grp Co Ltd, Jiayuguan 735100, Peoples R China",Chongqing University of Posts & Telecommunications; University of Auckland; Beijing Institute of Technology,"Wang, P; Wang, Y (corresponding author), Chongqing Univ Posts & Telecommun, Sch Adv Mfg Engn, Chongqing 400065, Peoples R China.",ilovemymfandb@163.com; wang_yue@cqupt.edu.cn,"Billinghurst, Mark/AAJ-4236-2020",,,,,,50,11,11,6,25,SPRINGER LONDON LTD,LONDON,"236 GRAYS INN RD, 6TH FLOOR, LONDON WC1X 8HL, ENGLAND",1359-4338,1434-9957,,VIRTUAL REAL-LONDON,Virtual Real.,JUN,2023,27.0,2,,,,,1409.0,1430.0,,10.1007/s10055-023-00748-5,0.0,,JAN 2023,22,"Computer Science, Interdisciplinary Applications; Computer Science, Software Engineering; Imaging Science & Photographic Technology",Science Citation Index Expanded (SCI-EXPANDED),Computer Science; Imaging Science & Photographic Technology,I3LP6,36686612.0,"Green Published, Bronze",,,2024-11-14,WOS:000912383400001,0,Virtual reality; Spatial augmented reality; Virtual replicas or avatar; Remote collaboration; Hand gesture; Human-computer interaction; REALITY
145,J,"Lorson, F; Fgener, A; Hbner, A",,,,"Lorson, Fabian; Fuegener, Andreas; Huebner, Alexander",,,New team mates in the warehouse: Human interactions with automated and robotized systems,IISE TRANSACTIONS,,,English,Article,,,,,,Warehousing; human-machine interaction; behavioral operations; robotics,ORDER PICKING SYSTEMS; AUGMENTED REALITY; OPERATIONS MANAGEMENT; PERFORMANCE; STORAGE; DESIGN; WORKLOAD; TECHNOLOGY; EFFICIENCY; FRAMEWORK,"Despite all the technological progress in the arena of automated and robotized systems, humans will continue to play a significant role in the warehouse of the future, due to their distinctive skills and economic advantages for certain tasks. Although industry and engineering have mainly dealt with the design and functionalities of automated warehouses, the role of human factors and behavior is still underrepresented. However, many novel warehousing systems require human-machine interactions, leading to a growing scientific and managerial necessity to consider human factors and behavior, particularly for operational activities. This is the first study that comprehensively identifies and analyzes relevant behavioral issues of interactions between warehouse operators and machines. To do so, we develop a systematic framework that links human-machine interactions with behavioral issues and implications on system performance across all operational warehouse activities. Insights generated by interviews with warehousing experts are applied to identify the most important issues. We develop a comprehensive research agenda, consisting of a set of potential research questions associated to the identified behavioral issues. The discussion is enriched by providing theoretical and managerial insights from related domains and existing warehousing research. Ultimately, we consolidate our findings by developing overarching theoretical foundations and deriving unifying themes.","[Lorson, Fabian; Huebner, Alexander] Tech Univ Munich, Supply & Value Chain Management, Munich, Germany; [Fuegener, Andreas] Univ Cologne, Digital Supply Chain Management, Cologne, Germany",Technical University of Munich; University of Cologne,"Hbner, A (corresponding author), Tech Univ Munich, Supply & Value Chain Management, Munich, Germany.",alexander.huebner@tum.de,"Fgener, Andreas/ABF-2826-2021","Hubner, Alexander/0000-0002-1358-1284; Fugener, Andreas/0000-0002-4580-7444",,,,,119,13,13,4,36,TAYLOR & FRANCIS INC,PHILADELPHIA,"530 WALNUT STREET, STE 850, PHILADELPHIA, PA 19106 USA",2472-5854,2472-5862,,IISE TRANS,IISE Trans.,MAY 4,2023,55.0,5,,,,,536.0,553.0,,10.1080/24725854.2022.2072545,0.0,,MAY 2022,18,"Engineering, Industrial; Operations Research & Management Science",Science Citation Index Expanded (SCI-EXPANDED),Engineering; Operations Research & Management Science,9D1GW,,hybrid,,,2024-11-14,WOS:000810417500001,0,Warehousing; human-machine interaction; behavioral operations; robotics; ORDER PICKING SYSTEMS; AUGMENTED REALITY; OPERATIONS MANAGEMENT; PERFORMANCE; STORAGE; DESIGN; WORKLOAD; TECHNOLOGY; EFFICIENCY; FRAMEWORK
146,J,"Sainathuni, B; Guthrie, B; Parikh, PJ; Kong, N",,,,"Sainathuni, Bhanuteja; Guthrie, Bradley; Parikh, Pratik J.; Kong, Nan",,,Distribution planning for products with varying life cycles,FLEXIBLE SERVICES AND MANUFACTURING JOURNAL,,,English,Article,,,,,,Warehousing; Workload variance; Fashion products; Mixed-integer bilinear program; Neighborhood search heuristic,SUPPLY CHAIN; FASHION INDUSTRY; DESIGN; DECISIONS; CHANNEL; IMPACT; MODEL,"Distribution planning becomes increasingly complex when warehouses handle products with varying life cycles; long (basic) and short (fashion). The varying demand patterns and life-cycles associated with each product class require different planning decisions possibly with different objectives; cost-efficiency for basic products and time-responsiveness for fashion products. Although it may appear that such products may be handled separately from inventory and transportation perspectives, they certainly are inseparable at the warehouse as they often get handled simultaneously by the same warehouse resources (i.e., workers and technology). To address this challenge, we introduce a novel problem to the literature, the two-product class, multi-product quantities, multi-echelon, multi-period, distribution planning problem. The uniqueness of this problem is in jointly deriving optimal distribution plans for both product classes, combined with optimal warehouse design decisions (e.g., technology and workforce), in order to minimize the total cost. We model this problem as a mixed-integer bilinear optimization problem, which turns out to be computationally challenging when dealing with industry-size instances (e.g., 200 stores, 1000 products, and 28 time-periods). We, therefore, propose a heuristic based on the iterative local search framework and conduct a comprehensive experimental study. Results suggest that with an increase in the proportion of fashion products, there is a substantial increase in warehouse workload variation, and subsequently total cost. An increase in fashion window tends to mitigate the variation and so do situations where the warehouse is located in regions with higher worker costs.","[Sainathuni, Bhanuteja; Guthrie, Bradley; Parikh, Pratik J.] Wright State Univ, Dept Biomed Ind & Human Factors Engn, 207 Russ Engn Ctr,3640 Colonel Glenn Hwy, Dayton, OH 45435 USA; [Kong, Nan] Purdue Univ, Weldon Sch Biomed Engn, W Lafayette, IN 47907 USA",University System of Ohio; Wright State University Dayton; Purdue University System; Purdue University,"Parikh, PJ (corresponding author), Wright State Univ, Dept Biomed Ind & Human Factors Engn, 207 Russ Engn Ctr,3640 Colonel Glenn Hwy, Dayton, OH 45435 USA.",pratik.parikh@wright.edu,"Parikh, Pratik/AAV-8628-2020",,"National Science Foundation [1235061, 1235283]; Directorate For Engineering; Div Of Civil, Mechanical, & Manufact Inn [1235061, 1235283] Funding Source: National Science Foundation","National Science Foundation(National Science Foundation (NSF)); Directorate For Engineering; Div Of Civil, Mechanical, & Manufact Inn(National Science Foundation (NSF)NSF - Directorate for Engineering (ENG))","This research was partially supported by National Science Foundation Grants CMMI #1235061 and #1235283. The authors would also like to acknowledge the contribution of Mr. Christopher Hagmann, a former master's student at Purdue, on implementing the two-phase approach.",,29,1,1,1,18,SPRINGER,DORDRECHT,"VAN GODEWIJCKSTRAAT 30, 3311 GZ DORDRECHT, NETHERLANDS",1936-6582,1936-6590,,FLEX SERV MANUF J,Flex. Serv. Manuf. J.,MAR,2019,31.0,1,,,,,41.0,74.0,,10.1007/s10696-018-9314-1,0.0,,,34,"Engineering, Industrial; Engineering, Manufacturing; Operations Research & Management Science",Science Citation Index Expanded (SCI-EXPANDED); Social Science Citation Index (SSCI),Engineering; Operations Research & Management Science,HO3QA,,,,,2024-11-14,WOS:000460836800003,0,Warehousing; Workload variance; Fashion products; Mixed-integer bilinear program; Neighborhood search heuristic; SUPPLY CHAIN; FASHION INDUSTRY; DESIGN; DECISIONS; CHANNEL; IMPACT; MODEL
147,C,"Soltani, M; Pedro, A; Yang, J; Zaidi, SFA; Lee, D; Park, C",,"Banthia, N; Soleimani-Dashtaki, S; Mindess, S",,"Soltani, Mehrtash; Pedro, Akeem; Yang, Jaehun; Zaidi, Syed Farhan Alam; Lee, Doyeop; Park, Chansik",,,Isafeguard: A Proactive Solution for Construction Job Site Safety Monitoring,"SMART & SUSTAINABLE INFRASTRUCTURE: BUILDING A GREENER TOMORROW, ISSSI 2023",RILEM Bookseries,,English,Proceedings Paper,1st Interdisciplinary Symposium on Smart & Sustainable Infrastructure (ISSSI),"SEP 04-08, 2023","Vancouver, CANADA",,,AI; computer vision; safety monitoring; construction safety management,RISK,"Inherent hazards characterize the construction industry, and despite proper training and planning, accidents can still transpire during work. Furthermore, the manual monitoring processes traditionally employed are both time-consuming and costly. Safety managers often struggle with juggling diverse responsibilities beyond safety management, especially in large projects where there might be a shortage of personnel for effective on-site safety oversight. Thus, there is a necessity to integrate technological advancements that ensure real-time worker safety monitoring and alleviate the workload of on-site safety managers who oversee worker activities. The iSAFEGuard platform has been introduced to address this issue, incorporating cutting-edge technological monitoring innovations employing 127 unsafe scene detectors through Computer Vision (CV) technology. This platform has been developed to monitor and mitigate various risks, including falls, being caught in/between incidents, being struck by objects, electric shock occurrences, fires, etc. The advancement and application of techniques such as depth estimation, edge detection, and background subtraction in identifying these risks are discussed. Additionally, diverse applications of the iSAFEGuard platform on activities involving scaffolds, ladders, welding machinery, arrow saws, and others are explored. In conclusion, the iSAFEGuard platform presents an automated and technologically driven approach to safety management, enhancing the safety of construction workers and improving overall job site safety conditions.","[Soltani, Mehrtash; Pedro, Akeem; Yang, Jaehun; Zaidi, Syed Farhan Alam; Lee, Doyeop; Park, Chansik] Chung Ang Univ, Sch Architecture & Bldg Sci, Seoul 06974, South Korea",Chung Ang University,"Soltani, M (corresponding author), Chung Ang Univ, Sch Architecture & Bldg Sci, Seoul 06974, South Korea.",soltani@cau.ac.kr,,,"National Research Foundation of Korea (NRF) - Korea government (MSIT) [NRF-2022R1A2B5B02002553]; Basic Science Research Program through the National Research Foundation of Korea (NRF) - Ministry of Education [NRF-2020R1I1A1A01073167]; National R&D Project for Smart Construction Technology - Korea Agency for Infrastructure Technology Advancement under the Ministry of Land, Infrastructure and Transport [23SMIP-A158708-04]","National Research Foundation of Korea (NRF) - Korea government (MSIT)(National Research Foundation of KoreaMinistry of Science, ICT & Future Planning, Republic of KoreaMinistry of Science & ICT (MSIT), Republic of Korea); Basic Science Research Program through the National Research Foundation of Korea (NRF) - Ministry of Education(National Research Foundation of KoreaMinistry of Education (MOE), Republic of KoreaNational Research Council for Economics, Humanities & Social Sciences, Republic of Korea); National R&D Project for Smart Construction Technology - Korea Agency for Infrastructure Technology Advancement under the Ministry of Land, Infrastructure and Transport(Ministry of Land, Infrastructure & Transport (MOLIT), Republic of Korea)","This work was supported by the National Research Foundation of Korea (NRF) grant funded by the Korea government (MSIT) (No. NRF-2022R1A2B5B02002553) and Basic Science Research Program through the National Research Foundation of Korea (NRF) funded by the Ministry of Education (No. NRF-2020R1I1A1A01073167). We also need to acknowledge the support of the National R&D Project for Smart Construction Technology (No. 23SMIP-A158708-04) funded by the Korea Agency for Infrastructure Technology Advancement under the Ministry of Land, Infrastructure and Transport and managed by the Korea Expressway Corporation.",,16,0,0,2,2,SPRINGER INTERNATIONAL PUBLISHING AG,CHAM,"GEWERBESTRASSE 11, CHAM, CH-6330, SWITZERLAND",2211-0844,2211-0852,978-3-031-53391-4; 978-3-031-53389-1; 978-3-031-53388-4,RILEM BOOKSER,,,2024,48.0,,,,,,1150.0,1165.0,,10.1007/978-3-031-53389-1_101,0.0,,,16,"Construction & Building Technology; Engineering, Civil; Materials Science, Multidisciplinary",Conference Proceedings Citation Index - Science (CPCI-S),Construction & Building Technology; Engineering; Materials Science,BX2QT,,,,,2024-11-14,WOS:001267226300100,0,AI; computer vision; safety monitoring; construction safety management; RISK
148,J,"Eswaran, M; Bahubalendruni, MVAR",,,,"Eswaran, M.; Bahubalendruni, M. V. A. Raju",,,Augmented reality aided object mapping for worker assistance/training in an industrial assembly context: Exploration of affordance with existing guidance techniques,COMPUTERS & INDUSTRIAL ENGINEERING,,,English,Article,,,,,,Augmented reality; Virtual reality; Assembly; Disassembly; Object mapping,SUPPORT; SYSTEM,"In recent years, the affordances of immersive technologies in the industrial context have enabled the onsite worker to have increased potential towards handling the complex procedural and cognitive tasks involved in the strategy of manufacturing an appropriate product. This article describes the potential of Augmented Reality (AR) in terms of upgraded workplace understanding, training, and assisting semi-skilled/new workers in an industrial production environment. The different modes of instruction visualization techniques are investigated for the execution of assembly tasks and explored their impact in accordance to the efficiency of task execution, completion time, error rate perception, cognitive load, and independence. Progress outcomes of 24 participants are explored for real-time execution of a Reverse osmosis (RO) booster pump assembly in terms of different modes of visualization, such as the conventional document method, virtual /desktop mode, and object mappingbased AR. Additionally, the user studies on different visualization devices involving hand-held visualization devices (HHVD) and Head-mounted visualization devices (HMVD) are investigated and validated in terms of adaptability, acceptability, and usability. Furthermore, the effectiveness of the AR-aided object mapping technology versus other methods is explored through the feedback received from both experts and academia participants, which increases the insight of the technology and provides an intelligent mechanism for semi-skilled/ new workers to handle complex or challenging operations in the production environment. The studies indicate that object mapping-based AR visualization facilitates increased assembly task efficiency and the minimum number of errors compared to the other guidance modes. Notably, the HMVD affords an increased realism experience, minimized errors, and less completion time compared to the HHVD.","[Eswaran, M.; Bahubalendruni, M. V. A. Raju] Natl Inst Technol Puducherry, Dept Mech Engn, Ind Robot & Mfg Automat Lab, Karaikal 609609, India",National Institute of Technology (NIT System); National Institute of Technology Puducherry,"Bahubalendruni, MVAR (corresponding author), Natl Inst Technol Puducherry, Dept Mech Engn, Ind Robot & Mfg Automat Lab, Karaikal 609609, India.",eswaranmnitpy@gmail.com; bahubalindruni@gmail.com,"M, E/KDM-8977-2024; M, Dr. Eswaran/HTN-4058-2023","M, Dr. Eswaran/0000-0002-2027-0759",,,,,45,14,14,4,12,PERGAMON-ELSEVIER SCIENCE LTD,OXFORD,"THE BOULEVARD, LANGFORD LANE, KIDLINGTON, OXFORD OX5 1GB, ENGLAND",0360-8352,1879-0550,,COMPUT IND ENG,Comput. Ind. Eng.,NOV,2023,185.0,,,,,,,,109663,10.1016/j.cie.2023.109663,0.0,,OCT 2023,16,"Computer Science, Interdisciplinary Applications; Engineering, Industrial",Science Citation Index Expanded (SCI-EXPANDED),Computer Science; Engineering,X3BQ7,,,,,2024-11-14,WOS:001097244600001,0,Augmented reality; Virtual reality; Assembly; Disassembly; Object mapping; SUPPORT; SYSTEM
149,J,"Le, AB; Wong, SW; Lin, HC; Smith, TD",,,,"Le, Aurora B.; Wong, Su-Wei; Lin, Hsien-Chang; Smith, Todd D.",,,The association between union membership and perceptions of safety climate among US adult workers,SAFETY SCIENCE,,,English,Article,,,,,,labor unions; safety; occupational health; matched-pair analysis; safety climate,JOB-SATISFACTION; TRANSFORMATIONAL LEADERSHIP; LABOR UNIONS; WORKING-CONDITIONS; CIVILITY NORMS; EMPLOYEE; ATTITUDES; INJURY; CULTURE; HEALTH,"Objectives: An individual's perceptions of their workplace safety climate can influence their health and safety outcomes in the workplace. Even though union membership has been declining in the US, union members still comprise 10% of the working population and have higher-than-industry average non-fatal illness and injury rates. Due to limited research focused in this area, this study examined whether union membership was associated with worker perceptions of safety climate. Methods: This was a secondary data analysis study utilizing data from the Quality Work Life module from the General Social Survey centered on US workers aged 18 and above. Propensity-score matching was implemented to reduce potential selection bias between unionized and non-unionized workers. Linear regression explored the association between union membership and perceptions of safety climate, controlling for age, sex, education, industry, resource adequacy, supervisor support, co-worker support, and workload. Results: For perceived safety climate (on a 0-16 scale, the higher the more positive), those in union had a lower mean of perceived safety climate (12.44) compared to those not in a union (13.20). Based on the regression results, those who were in a union reported more negative perceptions of their workplace safety climate in a 12-month period (beta = -0.61, p < .001). Conclusions: By demonstrating a commitment to proactive injury prevention and bolstering the business's overall safety performance indicators, businesses who are open to collaborations with unions may see some long-term benefits (e.g. return on investment, increased job satisfaction) and enhance union workers' perceptions of safety climate.","[Le, Aurora B.] Univ Michigan, Dept Environm Hlth Sci, Ann Arbor, MI 48109 USA; [Le, Aurora B.; Lin, Hsien-Chang; Smith, Todd D.] Indiana Univ, Dept Appl Hlth Sci, Sch Publ Hlth, Bloomington, IN 47405 USA; [Wong, Su-Wei] Univ Texas Hlth Sci Ctr Houston, Dept Hlth Promot & Behav Sci, Sch Publ Hlth, Houston, TX 77030 USA",University of Michigan System; University of Michigan; Indiana University System; Indiana University Bloomington; University of Texas System; University of Texas Health Science Center Houston; University of Texas School Public Health,"Le, AB (corresponding author), M6242,1415 Washington Hts, Ann Arbor, MI 48109 USA.",aurorale@umich.edu; Su-Wei.Wong@uth.tmc.edu; linhsi@indiana.edu; smithtod@indiana.edu,"Smith, Todd/AAI-1590-2021; Wong, Su-Wei/ABH-8079-2020; Le, Aurora/AAD-5005-2022","Smith, Todd/0000-0003-4306-3565; Le, Aurora/0000-0002-6866-6779; Wong, Su-Wei/0000-0003-0307-7815",,,,,100,9,10,4,33,ELSEVIER,AMSTERDAM,"RADARWEG 29, 1043 NX AMSTERDAM, NETHERLANDS",0925-7535,1879-1042,,SAFETY SCI,Saf. Sci.,JAN,2021,133.0,,,,,,,,105024,10.1016/j.ssci.2020.105024,0.0,,,9,"Engineering, Industrial; Operations Research & Management Science",Science Citation Index Expanded (SCI-EXPANDED); Social Science Citation Index (SSCI),Engineering; Operations Research & Management Science,OS5KL,33052171.0,Green Published,,,2024-11-14,WOS:000590202600033,0,labor unions; safety; occupational health; matched-pair analysis; safety climate; JOB-SATISFACTION; TRANSFORMATIONAL LEADERSHIP; LABOR UNIONS; WORKING-CONDITIONS; CIVILITY NORMS; EMPLOYEE; ATTITUDES; INJURY; CULTURE; HEALTH
150,J,"Qu, YB; Zhao, N; Zhang, HJ",,,,"Qu, Yanbo; Zhao, Ning; Zhang, Haojue",,,Digital Twin Technology of Human-Machine Integration in Cross-Belt Sorting System,CHINESE JOURNAL OF MECHANICAL ENGINEERING,,,English,Article,,,,,,Industry 5.0; Cross-belt sorting system; Human-machine integrated; Digital twin; Online optimization,CONTEXT,"The Chinese express delivery industry processes nearly 110 billion items in 2022, averaging an annual growth rate of 200%. Among the various types of sorting systems used for handling express items, cross-belt sorting systems stand out as the most crucial. However, despite their high degree of automation, the workload for operators has intensified owing to the surging volume of express items. In the era of Industry 5.0, it is imperative to adopt new technologies that not only enhance worker welfare but also improve the efficiency of cross-belt systems. Striking a balance between efficiency in handling express items and operator well-being is challenging. Digital twin technology offers a promising solution in this respect. A realization method of a human-machine integrated digital twin is proposed in this study, enabling the interaction of biological human bodies, virtual human bodies, virtual equipment, and logistics equipment in a closed loop, thus setting an operating framework. Key technologies in the proposed framework include a collection of heterogeneous data from multiple sources, construction of the relationship between operator fatigue and operation efficiency based on physiological measurements, virtual model construction, and an online optimization module based on real-time simulation. The feasibility of the proposed method was verified in an express distribution center.","[Qu, Yanbo; Zhao, Ning] Univ Sci & Technol Beijing, Sch Mech Engn, Beijing 100083, Peoples R China; [Qu, Yanbo] Chinese Acad Sci, Inst Microelect, Beijing 100029, Peoples R China; [Qu, Yanbo] Wayzim Technol Co Ltd, Wuxi 214108, Peoples R China; [Zhang, Haojue] Beijing Technol & Business Univ, Business Sch, Beijing 100048, Peoples R China","University of Science & Technology Beijing; Chinese Academy of Sciences; Institute of Microelectronics, CAS; Beijing Technology & Business University","Zhao, N (corresponding author), Univ Sci & Technol Beijing, Sch Mech Engn, Beijing 100083, Peoples R China.",zhning@sina.com,,"zhao, ning/0000-0001-9720-1746",Key Technologies Research and Development Program,Key Technologies Research and Development Program,Not applicable.,,35,1,1,14,17,SPRINGER,NEW YORK,"ONE NEW YORK PLAZA, SUITE 4600, NEW YORK, NY, UNITED STATES",1000-9345,2192-8258,,CHIN J MECH ENG-EN,Chin. J. Mech. Eng.,APR 7,2024,37.0,1,,,,,,,33,10.1186/s10033-024-01012-w,0.0,,,18,"Engineering, Mechanical",Science Citation Index Expanded (SCI-EXPANDED),Engineering,NA4W9,,"Green Submitted, gold",,,2024-11-14,WOS:001197715300001,0,Industry 5.0; Cross-belt sorting system; Human-machine integrated; Digital twin; Online optimization; CONTEXT
