94,C,"Rashid, Z; Shafiq, M; Aslam, MA; Menanno, M; Iqbal, N; Khan, HB; Ragno, P",,"Dagli, CH; Suer, GA",,"Rashid, Zahid; Shafiq, Muhammad; Aslam, Muhammad Awais; Menanno, Marialuisa; Iqbal, Neelum; Khan, Haji Bahader; Ragno, Pasquale",,,Assessment of Isometric Pulls Strength of Industrial Cart Pullers - An Electromyography Study from an Apparel Manufacturing Industry,25TH INTERNATIONAL CONFERENCE ON PRODUCTION RESEARCH MANUFACTURING INNOVATION: CYBER PHYSICAL MANUFACTURING,Procedia Manufacturing,,English,Proceedings Paper,25th International Conference on Production Research Manufacturing Innovation (ICPR) - Cyber Physical Manufacturing,"AUG 09-14, 2019","Chicago, IL",,,Isometric pull strength; Electromyography (EMG); Cart pullers; Maximum Voluntary Isometric Contraction (MVIC); Apparel Manufacturing,PUSH,"Manual material handling and occupational tasks demanding physical push-pull activities are very common in various industrial settings regardless of automation. These activities may become the cause of fatigue, accidents and/or different occupational hazards if not properly focused to balance workload as per physical strength and stamina of the worker. This cross-sectional study was conducted to assess the isometric pull strength of apparel cart/trolley pullers and muscular activity of upper limbs. Jackson strength evaluation system was used to measure isometric pull strengths while IXTA Data Acquisition System to measure and analyze the muscle activity. The experiments were conducted with twenty work-in-process (WIP) manual material handlers of an apparel manufacturing industry. Electromyographical (EMG) data of muscle activity was collected by placing electrodes on pronator teres, brachial biceps, pectoralis major and lower trapezius muscles during the pull tasks. The results show that torso pull in seated posture has the maximum isometric average value of 62.20 +/- 5.91 kg while arm lift has the minimum strength value of 37.10 +/- 4.61 kg. Assessment of muscle fatigue caused by pulling force is important in determining job severity of workers and mitigating occupational injuries which help in balancing workloads for effective management. (C) 2019 The Authors. Published by Elsevier Ltd.","[Rashid, Zahid; Shafiq, Muhammad; Aslam, Muhammad Awais; Iqbal, Neelum; Khan, Haji Bahader] Univ Engn & Technol, Dept Ind Engn, Taxila 47050, Pakistan; [Menanno, Marialuisa; Ragno, Pasquale] Univ Sannio, Dept Engn, I-82100 Benevento, Italy",University of Engineering & Technology Taxila; University of Sannio,"Shafiq, M (corresponding author), Univ Engn & Technol, Dept Ind Engn, Taxila 47050, Pakistan.",shafiqaatir1@gmail.com,"Rashid, Zahid/O-2422-2019","Shafiq, Muhammad/0000-0002-5475-3118",,,,,15,2,2,1,1,ELSEVIER SCIENCE BV,AMSTERDAM,"SARA BURGERHARTSTRAAT 25, PO BOX 211, 1000 AE AMSTERDAM, NETHERLANDS",2351-9789,,,PROCEDIA MANUF,,,2019,39.0,,,,,,1438.0,1446.0,,10.1016/j.promfg.2020.01.307,0.0,,,9,"Engineering, Manufacturing",Conference Proceedings Citation Index - Science (CPCI-S),Engineering,BU3AX,,"gold, Green Published",,,2024-11-14,WOS:000889480200166,0,Isometric pull strength; Electromyography (EMG); Cart pullers; Maximum Voluntary Isometric Contraction (MVIC); Apparel Manufacturing; PUSH
95,J,"Bozoklar, E; Yilmaz, E",,,,"Bozoklar, Emine; Yilmaz, Ebru",,,A Mathematical Programming Approach for Multi-Objective Optimization in Designing Flexible Manufacturing Cells,APPLIED SCIENCES-BASEL,,,English,Article,,,,,,flexible manufacturing cells; machine-system unbalance; worker-system unbalance; alternative routings; mathematical programming model,MACHINE-LOADING PROBLEM; PART TYPE SELECTION; MINIMIZING TOTAL INTERCELL; WORKLOAD-BASED MODEL; GENETIC ALGORITHM; OPERATOR ASSIGNMENT; HEURISTIC ALGORITHM; ALLOCATION PROBLEM; PLANNING PROBLEMS; SEARCH ALGORITHM,"The study aims to design flexible manufacturing cells with routing flexibility. A weighted mixed-integer linear mathematical programming model that aims to find optimal routing of parts in flexible manufacturing cells under constraints such as minimum machine utilization rate, maximum machine utilization rate, tool capacities, the utilization rate of workers, and labor-system unbalance is developed. The mathematical programming model aims to minimize the weighted sum of five objective functions: (1) the total number of intracellular movements; (2) the total number of intercellular movements; (3) the total workload unbalance of the machine system; (4) the total number of tools in all machines in the cells; and (5) the total labor-system workload unbalance. The main contribution of this study is to obtain these five objectives simultaneously, which have not been encountered to handle together before. By integrating these factors, the study presents a comprehensive approach to optimizing the design of flexible manufacturing cells. This study also has the potential to enhance system performance by addressing these factors. An illustrative problem tests the developed model, and the LINGO 17.0 optimization program is used to solve the generated mathematical programming model. Moreover, the related sensitivity analysis is performed with some parameters to examine the obtained results.","[Bozoklar, Emine] Iskenderun Tech Univ, Fac Engn & Nat Sci, Dept Ind Engn, TR-31200 Iskenderun, Hatay, Turkiye; [Yilmaz, Ebru] Cukurova Univ, Fac Engn, Dept Ind Engn, TR-01250 Adana, Turkiye",Iskenderun Technical University; Cukurova University,"Yilmaz, E (corresponding author), Cukurova Univ, Fac Engn, Dept Ind Engn, TR-01250 Adana, Turkiye.",emine.bozoklar@iste.edu.tr; eyilmaz@cu.edu.tr,"Bozoklar, Emine/JDD-8349-2023; Ylmaz, Ebru/G-3564-2018","Yilmaz, Ebru/0000-0002-7382-4081",,,,,69,0,0,10,20,MDPI,BASEL,"ST ALBAN-ANLAGE 66, CH-4052 BASEL, SWITZERLAND",,2076-3417,,APPL SCI-BASEL,Appl. Sci.-Basel,JUL,2023,13.0,13,,,,,,,7420,10.3390/app13137420,0.0,,,17,"Chemistry, Multidisciplinary; Engineering, Multidisciplinary; Materials Science, Multidisciplinary; Physics, Applied",Science Citation Index Expanded (SCI-EXPANDED),Chemistry; Engineering; Materials Science; Physics,M9HP8,,gold,,,2024-11-14,WOS:001033253900001,0,flexible manufacturing cells; machine-system unbalance; worker-system unbalance; alternative routings; mathematical programming model; MACHINE-LOADING PROBLEM; PART TYPE SELECTION; MINIMIZING TOTAL INTERCELL; WORKLOAD-BASED MODEL; GENETIC ALGORITHM; OPERATOR ASSIGNMENT; HEURISTIC ALGORITHM; ALLOCATION PROBLEM; PLANNING PROBLEMS; SEARCH ALGORITHM
96,C,"Tretkin, E; Saeedi, S; Bigdeli, S; Stadelmann, P; Cantale, N; Lutnyk, L; Raubal, M; Dunbar, LA",,"Jalali, B; Kitayama, KI",,"Turetkin, Engin; Saeedi, Sareh; Bigdeli, Siavash; Stadelmann, Patrick; Cantale, Nicolas; Lutnyk, Luis; Raubal, Martin; Dunbar, L. Andrea",,,Real Time Eye Gaze Tracking for Human Machine Interaction in the Cockpit,AI AND OPTICAL DATA SCIENCES III,Proceedings of SPIE,,English,Proceedings Paper,Conference on AI and Optical Data Sciences III,"JAN 22-FEB 24, 2022",ELECTR NETWORK,,,Gaze-based interaction; Eye gaze detection; Aviation; Computer vision; Machine learning; Human-machine interaction,,"The Aeronautics industry has pioneered safety from digital checklists to moving maps that improve pilot situational awareness and support safe ground movements. Today, pilots deal with increasingly complex cockpit environments and air traffic densification. Here we present an intelligent vision system, which allows real-time human-machine interaction in the cockpits to reduce pilot's workload. The challenges for such a vision system include extreme change in background light intensity, large field-of-view and variable working distances. Adapted hardware, use of state-of-the-art computer vision techniques and machine learning algorithms in eye gaze detection allow a smooth, and accurate real-time feedback system. The current system has been over-specified to explore the optimized solutions for different use-cases. The algorithmic pipeline for eye gaze tracking was developed and iteratively optimized to obtain the speed and accuracy required for the aviation use cases. The pipeline, which is a combination of data-driven and analytics approaches, runs in real time at 60 fps with a latency of about 32ms. The eye gaze estimation error was evaluated in terms of the point of regard distance error with respect to the 3D point location. An average error of less than 1.1cm was achieved over 28 gaze points representing the cockpit instruments placed at about 80-110cm from the participants' eyes. The angular gaze deviation goes down to less than 1 degrees for the panels towards which an accurate eye gaze was required according to the use cases.","[Turetkin, Engin; Saeedi, Sareh; Bigdeli, Siavash; Stadelmann, Patrick; Cantale, Nicolas; Dunbar, L. Andrea] CSEM SA, Edge AI & Vis Grp, Rue Jaquet Droz 1, CH-2002 Neuchatel, Switzerland; [Lutnyk, Luis; Raubal, Martin] Swiss Fed Inst Technol, Inst Cartog & Geoinformat, Stefano Franscini Pl 5, CH-8093 Zurich, Switzerland",Swiss Center for Electronics & Microtechnology (CSEM); Swiss Federal Institutes of Technology Domain; ETH Zurich,"Tretkin, E (corresponding author), CSEM SA, Edge AI & Vis Grp, Rue Jaquet Droz 1, CH-2002 Neuchatel, Switzerland.",engin.tueretken@csem.ch,"Arjomand Bigdeli, Siavash/HSG-6682-2023",,Clean Sky 2 Joint Undertaking under the European Union's Horizon 2020 research and innovation program [821461]; H2020 Societal Challenges Programme [821461] Funding Source: H2020 Societal Challenges Programme,Clean Sky 2 Joint Undertaking under the European Union's Horizon 2020 research and innovation program; H2020 Societal Challenges Programme(Horizon 2020European Union (EU)H2020 Societal Challenges Programme),"The system was developed in collaboration with aviation experts from SERMA Ingenierie, SWISS International Air Lines and ETHZ within an EU-CleanSky project: PEGGASUS. PEGGASUS project has received funding from the Clean Sky 2 Joint Undertaking under the European Union's Horizon 2020 research and innovation program under grant agreement No. 821461.",,11,1,1,3,18,SPIE-INT SOC OPTICAL ENGINEERING,BELLINGHAM,"1000 20TH ST, PO BOX 10, BELLINGHAM, WA 98227-0010 USA",0277-786X,1996-756X,978-1-5106-4910-1; 978-1-5106-4909-5,PROC SPIE,,,2022,12019.0,,,,,,,,1201904,10.1117/12.2607434,0.0,,,10,"Computer Science, Artificial Intelligence; Optics",Conference Proceedings Citation Index - Science (CPCI-S),Computer Science; Optics,BT3YT,,,,,2024-11-14,WOS:000825409100003,0,Gaze-based interaction; Eye gaze detection; Aviation; Computer vision; Machine learning; Human-machine interaction
97,C,"Coppola, C; Solak, G; Jamone, L",,,IEEE,"Coppola, Claudio; Solak, Gokhan; Jamone, Lorenzo",,,An affordable system for the teleoperation of dexterous robotic hands using Leap Motion hand tracking and vibrotactile feedback,2022 31ST IEEE INTERNATIONAL CONFERENCE ON ROBOT AND HUMAN INTERACTIVE COMMUNICATION (IEEE RO-MAN 2022),,,English,Proceedings Paper,"31st IEEE International Conference on Robot and Human Interactive Communication (RO-MAN) - Social, Asocial, and Antisocial Robots","AUG 29-SEP 02, 2022","Napoli, ITALY",,,,,"Using robot manipulators in contexts where it is undesirable or impractical for humans to physically intervene is crucial for several applications, from manufacturing to extreme environments. However, robots require a high degree of intelligence to operate in those environments, especially if they are not fully structured. Teleoperation compensates for this limitation by connecting the human operator to the robot using human-robot interfaces. The remotely operated sessions can also be used as demonstrations to program more powerful autonomous agents. In this article, we report a thorough user study to characterise the effect of simple vibrotactile feedback on the performance and cognitive load of the human user in performing teleoperated grasping and manipulation tasks. The experiments are performed using a portable and affordable bilateral teleoperation system that we designed, composed of a Leap Motion sensor and a custom-designed vibrotactile haptic glove to operate a 4-fingered robot hand equipped with 3axis force sensors on the fingertips; the software packages we developed are open-source and publicly available. Our results show that vibrotactile feedback improves teleoperation and reduces cognitive load, especially for complex in-hand manipulation tasks.","[Coppola, Claudio; Solak, Gokhan; Jamone, Lorenzo] Queen Mary Univ London, ARQ Adv Robot Queen Mary, Sch Elect Engn & Comp Sci, London E14NS, England",University of London; Queen Mary University London,"Coppola, C (corresponding author), Queen Mary Univ London, ARQ Adv Robot Queen Mary, Sch Elect Engn & Comp Sci, London E14NS, England.",c.coppola@qmul.uk; g.solak@qmul.uk; l.jamone@qmul.uk,"Jamone, Lorenzo/Q-8633-2016; Coppola, Claudio/AAC-3144-2021",,"EPSRC UK [EP/R02572X/1, EP/S00453X/1]; EPSRC [EP/S00453X/1] Funding Source: UKRI",EPSRC UK(UK Research & Innovation (UKRI)Engineering & Physical Sciences Research Council (EPSRC)); EPSRC(UK Research & Innovation (UKRI)Engineering & Physical Sciences Research Council (EPSRC)),Work partially supported by the EPSRC UK through projects NCNR (EP/R02572X/1) and MAN3 (EP/S00453X/1).,,39,3,3,0,2,IEEE,NEW YORK,"345 E 47TH ST, NEW YORK, NY 10017 USA",,,978-1-7281-8859-1,,,,2022,,,,,,,920.0,926.0,,10.1109/RO-MAN53752.2022.9900583,0.0,,,7,"Computer Science, Cybernetics; Ergonomics; Robotics",Conference Proceedings Citation Index - Science (CPCI-S); Conference Proceedings Citation Index - Social Science & Humanities (CPCI-SSH),Computer Science; Engineering; Robotics,BU2LT,,,,,2024-11-14,WOS:000885903300133,0,
98,J,"Yilmaz, OF",,,,"Yilmaz, Omer Faruk",,,Operational strategies for seru production system: a bi-objective optimisation model and solution methods,INTERNATIONAL JOURNAL OF PRODUCTION RESEARCH,,,English,Article,,,,,,seru production system; NSGA-II; AUGMECON2; worker transfer; bi-objective workforce scheduling problem,LINE-CELL CONVERSION; EPSILON-CONSTRAINT METHOD; CONVEYOR ASSEMBLY-LINE; NSGA-II ALGORITHM; LOCAL SEARCH; COST; SERIAL,"In recent years, the interest in seru production system (SPS) has increased to enhance the flexibility of production systems. Because the worker resource in an SPS is critical for adapting to changes in demand, this study focuses on workforce-related operational strategies rarely considered for SPS. To this end, for the first time in the literature, a bi-objective workforce scheduling problem is addressed by considering the interseru worker transfer in SPS. A novel optimisation model is proposed to achieve two objectives, that of minimising makespan and reducing workload imbalance among workers. Because it is proved that the problem falls within a non-deterministic polynomial-time hardness (NP-hard) class, non-dominated sorting genetic algorithm-II (NSGA-II) is employed to solve large-sized problems. For small-sized problems, the second version of the augmented epsilon-constrained (AUGMECON2) method is implemented and Pareto-optimal solutions are obtained. A set of evaluation metrics is considered to compare two different operational strategies in terms of the desired objectives. The computational results indicate that allowing worker transfer leads to better results for all metrics. The main contribution of the present study is to provide a novel optimisation model for the addressed problem to compare two operational strategies by considering the heterogeneity inherent of workers.","[Yilmaz, Omer Faruk] Karadeniz Tech Univ, Dept Ind Engn, Trabzon, Turkey",Karadeniz Technical University,"Yilmaz, OF (corresponding author), Karadeniz Tech Univ, Dept Ind Engn, Trabzon, Turkey.",omerfarukyilmaz@ktu.edu.tr,"Yilmaz, Omer Faruk/N-4085-2016","Yilmaz, Omer Faruk/0000-0002-6202-4011",,,,,57,48,52,4,39,TAYLOR & FRANCIS LTD,ABINGDON,"2-4 PARK SQUARE, MILTON PARK, ABINGDON OR14 4RN, OXON, ENGLAND",0020-7543,1366-588X,,INT J PROD RES,Int. J. Prod. Res.,,2020,58.0,11,,,,,3195.0,3219.0,,10.1080/00207543.2019.1669841,0.0,,,25,"Engineering, Industrial; Engineering, Manufacturing; Operations Research & Management Science",Science Citation Index Expanded (SCI-EXPANDED),Engineering; Operations Research & Management Science,NA4OT,,,,,2024-11-14,WOS:000559798100001,0,seru production system; NSGA-II; AUGMECON2; worker transfer; bi-objective workforce scheduling problem; LINE-CELL CONVERSION; EPSILON-CONSTRAINT METHOD; CONVEYOR ASSEMBLY-LINE; NSGA-II ALGORITHM; LOCAL SEARCH; COST; SERIAL
99,J,"Wixted, F; O' Sullivan, L",,,,"Wixted, Fiona; O' Sullivan, Leonard",,,The moderating role of end-tidal CO2 on upper trapezius muscle activity in response to sustained attention,INTERNATIONAL JOURNAL OF INDUSTRIAL ERGONOMICS,,,English,Article,,,,,,Sustained attention; Mental workload; Muscle activity; Work related musculoskeletal disorders,MOTOR UNIT RECRUITMENT; MUSCULOSKELETAL SYMPTOMS; SUBJECTIVE WORKLOAD; TASK ENGAGEMENT; RISK-FACTORS; BLOOD-FLOW; STRESS; VIGILANCE; PERFORMANCE; DEMANDS,"With higher levels of automation in modern manufacturing, there is increased monitoring of the process by the human operator. Prolonged monitoring or sustained attention has been found to be stressful for human operators. Plant and process operators have also been found to have one of the highest level of work demands (work speed, pace) in a recent European survey (Eurofound, 2015). Along with this, the incidence of Work Related Musculoskeletal Disorders (WRMSDs) remains at a high level in the manufacturing sector. This research endeavoured to determine if end-tidal CO2 levels decreased and upper trapezius muscle activity increased concurrently with increased levels of attention. We then developed a model to investigate if end-tidal CO2 moderated the relationship between mental workload due to sustained attention and upper trapezius muscle activity. The resulting interactional model found that end-tidal CO2 moderated the relationship (p = 0.004) when end-tidal CO2 reached the hypocapnic range (>35 mm Hg). This model indicates the possibility that a high level of sustained attention is a risk factor in the development of WRMSDs and should therefore be included in workplace risk assessments. (C) 2017 Elsevier B.V. All rights reserved.","[Wixted, Fiona; O' Sullivan, Leonard] Univ Limerick, Dept Design & Mfg Technol, Limerick, Ireland",University of Limerick,"Wixted, F (corresponding author), Univ Limerick, Ergon Res Ctr, Dept Design & Mfg Technol, Sch Design, Limerick, Ireland.",Fiona.wixted@ul.ie; Leonard.osullivan@ul.ie,"OSullivan, Leonard/AAK-4853-2021","O'Sullivan, Leonard/0000-0002-0255-1979",7th Framework Programme for Research and Technological Development of the European Union [608979],7th Framework Programme for Research and Technological Development of the European Union(European Union (EU)),"This work was supported by the 7th Framework Programme for Research and Technological Development of the European Union (FP7), Robo-Mate project under grant agreement no 608979. There are no conflicts of interest to be declared.",,115,4,4,0,10,ELSEVIER,AMSTERDAM,"RADARWEG 29, 1043 NX AMSTERDAM, NETHERLANDS",0169-8141,1872-8219,,INT J IND ERGONOM,Int. J. Ind. Ergon.,SEP,2017,61.0,,,,,,1.0,12.0,,10.1016/j.ergon.2017.04.003,0.0,,,12,"Engineering, Industrial; Ergonomics",Science Citation Index Expanded (SCI-EXPANDED); Social Science Citation Index (SSCI),Engineering,FF3HZ,,Green Submitted,,,2024-11-14,WOS:000408787400001,0,Sustained attention; Mental workload; Muscle activity; Work related musculoskeletal disorders; MOTOR UNIT RECRUITMENT; MUSCULOSKELETAL SYMPTOMS; SUBJECTIVE WORKLOAD; TASK ENGAGEMENT; RISK-FACTORS; BLOOD-FLOW; STRESS; VIGILANCE; PERFORMANCE; DEMANDS
100,J,"Marino, E; Barbieri, L; Colacino, B; Fleri, AK; Bruno, F",,,,"Marino, Emanuele; Barbieri, Loris; Colacino, Biagio; Fleri, Anna Kum; Bruno, Fabio",,,An Augmented Reality inspection tool to support workers in Industry 4.0 environments,COMPUTERS IN INDUSTRY,,,English,Article,,,,,,Augmented Reality; Industry 4.0; Operator 4.0; Google ARCore; Marker-based tracking; Usability studies,MIXED REALITY; UMUX-LITE; MAINTENANCE; SYSTEM; SUS; GUIDANCE; USABILITY; DESIGN,"Among the key technologies of Industry 4.0, Augmented Reality (AR) is one of the most promising and enabling technologies for supporting factory workers and engineers at the workplace. To this end, the paper proposes a novel AR tool to assist operators during the inspection activities for the detection of production and assembly errors. In fact, thanks to the superimposition of the 3D models, as designed by the technical office, a worker can easily detect the presence of design discrepancies on the final physical assembled product and report them by adding 3D annotations directly on virtual models. This AR tool has been developed by using ARCore (TM) libraries to ensure, in the first place, its compatibility with commonly used devices for which workers are already trained and, secondly, to take advantage of the hybrid-tracking techniques that combine vision- and sensor-based methods to improve the reliability of the AR visualization. Nevertheless, the proposed AR tool adopts multiple markers to minimize tracking errors and therefore to provide greater freedom of movement to the user, who can use the tool also for the assessment of large-size products. Field experimentations have been carried out on a real case study with end-users in order to assess its usability and perceived mental workload through the SUS (System Usability Scale) and NASA-TLX (Task Load Index) standard questionnaires, respectively. The usability study was performed taking into account also objective metrics, i.e., by analysing user performance in target acquisition tasks while interacting with the AR tool. Statistical analysis proved that the adoption of this AR tool requires low mental demand, and its usability has reached a high level of satisfaction both by the factory workers and engineers involved in the user study. (C) 2021 Elsevier B.V. All rights reserved.","[Marino, Emanuele; Barbieri, Loris; Bruno, Fabio] Univ Calabria, Dept Mech Energy & Management Engn DIMEG, P Bucci 46C, I-87036 Arcavacata Di Rende, CS, Italy; [Colacino, Biagio; Fleri, Anna Kum] Nuovo Pignone Srl, I-89900 Vibo Valentia, Italy",University of Calabria,"Marino, E (corresponding author), Univ Calabria, Dept Mech Energy & Management Engn DIMEG, P Bucci 46C, I-87036 Arcavacata Di Rende, CS, Italy.",emanuele.marino@unical.it; loris.barbieri@unical.it; biagio.colacino@bakerhughes.com; annakum.fleri@bakerhughes.com; fabio.bruno@unical.it,"Bruno, Fabio/F-5828-2011; Barbieri, Loris/AAH-1095-2021","Marino, Emanuele/0000-0002-0887-1201",project SMILE - Italian MISE under the PON Imprese e Competitivita program [F/190084/03/X44 - CUP: B21B19000530008 COR: 1679960],project SMILE - Italian MISE under the PON Imprese e Competitivita program,"This research has been partially funded by the project SMILE, funded by the Italian MISE under the PON Imprese e Competitivita program. Project n. F/190084/03/X44 - CUP: B21B19000530008 COR: 1679960.",,97,78,83,4,107,ELSEVIER,AMSTERDAM,"RADARWEG 29, 1043 NX AMSTERDAM, NETHERLANDS",0166-3615,1872-6194,,COMPUT IND,Comput. Ind.,MAY,2021,127.0,,,,,,,,103412,10.1016/j.compind.2021.103412,0.0,,FEB 2021,13,"Computer Science, Interdisciplinary Applications",Science Citation Index Expanded (SCI-EXPANDED); Social Science Citation Index (SSCI),Computer Science,QL6LR,,,,,2024-11-14,WOS:000621196000004,0,Augmented Reality; Industry 4.0; Operator 4.0; Google ARCore; Marker-based tracking; Usability studies; MIXED REALITY; UMUX-LITE; MAINTENANCE; SYSTEM; SUS; GUIDANCE; USABILITY; DESIGN
